root@ubuntu-s-1vcpu-1gb-nyc1-01:~# tcpdump -n -i eth0
tcpdump: verbose output suppressed, use -v or -vv for full protocol decode
listening on eth0, link-type EN10MB (Ethernet), capture size 262144 bytes
00:17:57.182944 IP 67.205.184.200.22 > 69.166.116.10.5276: Flags [P.], seq 4125590105:4125590213, ack 2999387678, win 501, length 108
00:17:57.182992 IP 67.205.184.200.22 > 69.166.116.10.5276: Flags [P.], seq 108:144, ack 1, win 501, length 36
00:17:57.183053 IP 67.205.184.200.22 > 69.166.116.10.5276: Flags [P.], seq 144:252, ack 1, win 501, length 108
00:17:57.183078 IP 67.205.184.200.22 > 69.166.116.10.5276: Flags [P.], seq 252:288, ack 1, win 501, length 36
00:17:57.194224 IP 69.166.116.10.5276 > 67.205.184.200.22: Flags [.], ack 4294967216, win 510, length 0
00:17:57.194261 IP 67.205.184.200.22 > 69.166.116.10.5276: Flags [P.], seq 288:1048, ack 1, win 501, length 760
00:17:57.194392 IP 67.205.184.200.22 > 69.166.116.10.5276: Flags [P.], seq 1048:1188, ack 1, win 501, length 140
00:17:57.194431 IP 67.205.184.200.22 > 69.166.116.10.5276: Flags [P.], seq 1188:1224, ack 1, win 501, length 36
00:17:57.194471 IP 67.205.184.200.22 > 69.166.116.10.5276: Flags [P.], seq 1224:1372, ack 1, win 501, length 148
00:17:57.196190 IP 69.166.116.10.5276 > 67.205.184.200.22: Flags [.], ack 0, win 509, length 0
00:17:57.196207 IP 67.205.184.200.22 > 69.166.116.10.5276: Flags [P.], seq 1372:1960, ack 1, win 501, length 588
00:17:57.196268 IP 67.205.184.200.22 > 69.166.116.10.5276: Flags [P.], seq 1960:2092, ack 1, win 501, length 132
00:17:57.197117 IP 69.166.116.10.5276 > 67.205.184.200.22: Flags [.], ack 252, win 508, length 0
00:17:57.197127 IP 67.205.184.200.22 > 69.166.116.10.5276: Flags [P.], seq 2092:2496, ack 1, win 501, length 404
00:17:57.197193 IP 67.205.184.200.22 > 69.166.116.10.5276: Flags [P.], seq 2496:2628, ack 1, win 501, length 132
00:17:57.197222 IP 67.205.184.200.22 > 69.166.116.10.5276: Flags [P.], seq 2628:2664, ack 1, win 501, length 36
00:17:57.203791 IP 69.166.116.10.5276 > 67.205.184.200.22: Flags [.], ack 288, win 508, length 0
00:17:57.203821 IP 67.205.184.200.22 > 69.166.116.10.5276: Flags [P.], seq 2664:3216, ack 1, win 501, length 552
00:17:57.207101 IP 69.166.116.10.5276 > 67.205.184.200.22: Flags [.], ack 1188, win 513, length 0
00:17:57.207124 IP 67.205.184.200.22 > 69.166.116.10.5276: Flags [P.], seq 3216:3568, ack 1, win 501, length 352
00:17:57.207230 IP 67.205.184.200.22 > 69.166.116.10.5276: Flags [P.], seq 3568:3700, ack 1, win 501, length 132
00:17:57.207854 IP 69.166.116.10.5276 > 67.205.184.200.22: Flags [.], ack 1372, win 512, length 0
00:17:57.207862 IP 67.205.184.200.22 > 69.166.116.10.5276: Flags [P.], seq 3700:4104, ack 1, win 501, length 404
00:17:57.207919 IP 67.205.184.200.22 > 69.166.116.10.5276: Flags [P.], seq 4104:4236, ack 1, win 501, length 132
00:17:57.210108 IP 69.166.116.10.5276 > 67.205.184.200.22: Flags [.], ack 2092, win 509, length 0
00:17:57.210127 IP 67.205.184.200.22 > 69.166.116.10.5276: Flags [P.], seq 4236:4640, ack 1, win 501, length 404
00:17:57.210207 IP 67.205.184.200.22 > 69.166.116.10.5276: Flags [P.], seq 4640:4772, ack 1, win 501, length 132
00:17:57.212554 IP 69.166.116.10.5276 > 67.205.184.200.22: Flags [.], ack 2628, win 507, length 0
00:17:57.212571 IP 67.205.184.200.22 > 69.166.116.10.5276: Flags [P.], seq 4772:5176, ack 1, win 501, length 404
00:17:57.212652 IP 67.205.184.200.22 > 69.166.116.10.5276: Flags [P.], seq 5176:5308, ack 1, win 501, length 132
00:17:57.217037 IP 69.166.116.10.5276 > 67.205.184.200.22: Flags [.], ack 3216, win 513, length 0
00:17:57.217056 IP 67.205.184.200.22 > 69.166.116.10.5276: Flags [P.], seq 5308:5712, ack 1, win 501, length 404
00:17:57.217139 IP 67.205.184.200.22 > 69.166.116.10.5276: Flags [P.], seq 5712:5844, ack 1, win 501, length 132
00:17:57.220019 IP 69.166.116.10.5276 > 67.205.184.200.22: Flags [.], ack 3700, win 511, length 0
00:17:57.220036 IP 67.205.184.200.22 > 69.166.116.10.5276: Flags [P.], seq 5844:6248, ack 1, win 501, length 404
00:17:57.220125 IP 67.205.184.200.22 > 69.166.116.10.5276: Flags [P.], seq 6248:6380, ack 1, win 501, length 132
00:17:57.221644 IP 69.166.116.10.5276 > 67.205.184.200.22: Flags [.], ack 4236, win 509, length 0
00:17:57.221660 IP 67.205.184.200.22 > 69.166.116.10.5276: Flags [P.], seq 6380:6784, ack 1, win 501, length 404
00:17:57.221736 IP 67.205.184.200.22 > 69.166.116.10.5276: Flags [P.], seq 6784:6916, ack 1, win 501, length 132
00:17:57.224011 IP 69.166.116.10.5276 > 67.205.184.200.22: Flags [.], ack 4772, win 513, length 0
00:17:57.224029 IP 67.205.184.200.22 > 69.166.116.10.5276: Flags [P.], seq 6916:7320, ack 1, win 501, length 404
00:17:57.224112 IP 67.205.184.200.22 > 69.166.116.10.5276: Flags [P.], seq 7320:7452, ack 1, win 501, length 132
00:17:57.225741 IP 69.166.116.10.5276 > 67.205.184.200.22: Flags [.], ack 5308, win 511, length 0
00:17:57.225750 IP 67.205.184.200.22 > 69.166.116.10.5276: Flags [P.], seq 7452:7856, ack 1, win 501, length 404
00:17:57.225799 IP 67.205.184.200.22 > 69.166.116.10.5276: Flags [P.], seq 7856:7988, ack 1, win 501, length 132
00:17:57.231194 IP 69.166.116.10.5276 > 67.205.184.200.22: Flags [.], ack 5844, win 509, length 0
00:17:57.231222 IP 67.205.184.200.22 > 69.166.116.10.5276: Flags [P.], seq 7988:8392, ack 1, win 501, length 404
00:17:57.231328 IP 67.205.184.200.22 > 69.166.116.10.5276: Flags [P.], seq 8392:8524, ack 1, win 501, length 132
00:17:57.237737 IP 69.166.116.10.5276 > 67.205.184.200.22: Flags [.], ack 6380, win 513, length 0
00:17:57.237737 IP 69.166.116.10.5276 > 67.205.184.200.22: Flags [.], ack 6916, win 511, length 0
00:17:57.237759 IP 67.205.184.200.22 > 69.166.116.10.5276: Flags [P.], seq 8524:8928, ack 1, win 501, length 404
00:17:57.237848 IP 67.205.184.200.22 > 69.166.116.10.5276: Flags [P.], seq 8928:9060, ack 1, win 501, length 132
00:17:57.237884 IP 67.205.184.200.22 > 69.166.116.10.5276: Flags [P.], seq 9060:9096, ack 1, win 501, length 36
00:17:57.237919 IP 67.205.184.200.22 > 69.166.116.10.5276: Flags [P.], seq 9096:9228, ack 1, win 501, length 132
00:17:57.238307 IP 69.166.116.10.5276 > 67.205.184.200.22: Flags [.], ack 7452, win 509, length 0
00:17:57.238313 IP 67.205.184.200.22 > 69.166.116.10.5276: Flags [P.], seq 9228:10000, ack 1, win 501, length 772
00:17:57.238352 IP 67.205.184.200.22 > 69.166.116.10.5276: Flags [P.], seq 10000:10132, ack 1, win 501, length 132
00:17:57.238799 IP 69.166.116.10.5276 > 67.205.184.200.22: Flags [.], ack 7988, win 513, length 0
00:17:57.238805 IP 67.205.184.200.22 > 69.166.116.10.5276: Flags [P.], seq 10132:10536, ack 1, win 501, length 404
00:17:57.238843 IP 67.205.184.200.22 > 69.166.116.10.5276: Flags [P.], seq 10536:10668, ack 1, win 501, length 132
00:17:57.244372 IP 69.166.116.10.5276 > 67.205.184.200.22: Flags [.], ack 8524, win 511, length 0
00:17:57.244398 IP 67.205.184.200.22 > 69.166.116.10.5276: Flags [P.], seq 10668:11072, ack 1, win 501, length 404
00:17:57.244502 IP 67.205.184.200.22 > 69.166.116.10.5276: Flags [P.], seq 11072:11204, ack 1, win 501, length 132
00:17:57.253223 IP 69.166.116.10.5276 > 67.205.184.200.22: Flags [.], ack 9228, win 508, length 0
00:17:57.253223 IP 69.166.116.10.5276 > 67.205.184.200.22: Flags [.], ack 10132, win 513, length 0
00:17:57.253223 IP 69.166.116.10.5276 > 67.205.184.200.22: Flags [.], ack 10668, win 511, length 0
00:17:57.253261 IP 67.205.184.200.22 > 69.166.116.10.5276: Flags [P.], seq 11204:11608, ack 1, win 501, length 404
00:17:57.253391 IP 67.205.184.200.22 > 69.166.116.10.5276: Flags [P.], seq 11608:11740, ack 1, win 501, length 132
00:17:57.253428 IP 67.205.184.200.22 > 69.166.116.10.5276: Flags [P.], seq 11740:11776, ack 1, win 501, length 36
00:17:57.253466 IP 67.205.184.200.22 > 69.166.116.10.5276: Flags [P.], seq 11776:11908, ack 1, win 501, length 132
00:17:57.253491 IP 67.205.184.200.22 > 69.166.116.10.5276: Flags [P.], seq 11908:11944, ack 1, win 501, length 36
00:17:57.253524 IP 67.205.184.200.22 > 69.166.116.10.5276: Flags [P.], seq 11944:12076, ack 1, win 501, length 132
00:17:57.253551 IP 67.205.184.200.22 > 69.166.116.10.5276: Flags [P.], seq 12076:12112, ack 1, win 501, length 36
00:17:57.253583 IP 67.205.184.200.22 > 69.166.116.10.5276: Flags [P.], seq 12112:12260, ack 1, win 501, length 148
00:17:57.257953 IP 69.166.116.10.5276 > 67.205.184.200.22: Flags [.], ack 11204, win 509, length 0
00:17:57.257979 IP 67.205.184.200.22 > 69.166.116.10.5276: Flags [P.], seq 12260:13584, ack 1, win 501, length 1324
00:17:57.258089 IP 67.205.184.200.22 > 69.166.116.10.5276: Flags [P.], seq 13584:13716, ack 1, win 501, length 132
00:17:57.258132 IP 67.205.184.200.22 > 69.166.116.10.5276: Flags [P.], seq 13716:13752, ack 1, win 501, length 36
00:17:57.267631 IP 69.166.116.10.5276 > 67.205.184.200.22: Flags [.], ack 12260, win 513, length 0
00:17:57.267663 IP 67.205.184.200.22 > 69.166.116.10.5276: Flags [P.], seq 13752:14312, ack 1, win 501, length 560
00:17:57.267775 IP 67.205.184.200.22 > 69.166.116.10.5276: Flags [P.], seq 14312:14444, ack 1, win 501, length 132
00:17:57.267812 IP 67.205.184.200.22 > 69.166.116.10.5276: Flags [P.], seq 14444:14480, ack 1, win 501, length 36
00:17:57.267852 IP 67.205.184.200.22 > 69.166.116.10.5276: Flags [P.], seq 14480:14628, ack 1, win 501, length 148
00:17:57.267882 IP 67.205.184.200.22 > 69.166.116.10.5276: Flags [P.], seq 14628:14664, ack 1, win 501, length 36
00:17:57.267929 IP 67.205.184.200.22 > 69.166.116.10.5276: Flags [P.], seq 14664:14812, ack 1, win 501, length 148
00:17:57.267955 IP 67.205.184.200.22 > 69.166.116.10.5276: Flags [P.], seq 14812:14848, ack 1, win 501, length 36
00:17:57.267986 IP 67.205.184.200.22 > 69.166.116.10.5276: Flags [P.], seq 14848:14996, ack 1, win 501, length 148
00:17:57.271622 IP 69.166.116.10.5276 > 67.205.184.200.22: Flags [.], ack 13716, win 507, length 0
00:17:57.271641 IP 67.205.184.200.22 > 69.166.116.10.5276: Flags [P.], seq 14996:15952, ack 1, win 501, length 956
00:17:57.271718 IP 67.205.184.200.22 > 69.166.116.10.5276: Flags [P.], seq 15952:16084, ack 1, win 501, length 132
00:17:57.271750 IP 67.205.184.200.22 > 69.166.116.10.5276: Flags [P.], seq 16084:16120, ack 1, win 501, length 36
00:17:57.281449 IP 69.166.116.10.5276 > 67.205.184.200.22: Flags [.], ack 14628, win 513, length 0
00:17:57.281449 IP 69.166.116.10.5276 > 67.205.184.200.22: Flags [.], ack 14996, win 511, length 0
00:17:57.281487 IP 67.205.184.200.22 > 69.166.116.10.5276: Flags [P.], seq 16120:16672, ack 1, win 501, length 552
00:17:57.281582 IP 67.205.184.200.22 > 69.166.116.10.5276: Flags [P.], seq 16672:16804, ack 1, win 501, length 132
00:17:57.281617 IP 67.205.184.200.22 > 69.166.116.10.5276: Flags [P.], seq 16804:16840, ack 1, win 501, length 36
00:17:57.281666 IP 67.205.184.200.22 > 69.166.116.10.5276: Flags [P.], seq 16840:16972, ack 1, win 501, length 132
00:17:57.281692 IP 67.205.184.200.22 > 69.166.116.10.5276: Flags [P.], seq 16972:17008, ack 1, win 501, length 36
00:17:57.281725 IP 67.205.184.200.22 > 69.166.116.10.5276: Flags [P.], seq 17008:17156, ack 1, win 501, length 148
00:17:57.281749 IP 67.205.184.200.22 > 69.166.116.10.5276: Flags [P.], seq 17156:17192, ack 1, win 501, length 36
00:17:57.281780 IP 67.205.184.200.22 > 69.166.116.10.5276: Flags [P.], seq 17192:17340, ack 1, win 501, length 148
00:17:57.281806 IP 67.205.184.200.22 > 69.166.116.10.5276: Flags [P.], seq 17340:17376, ack 1, win 501, length 36
00:17:57.284415 IP 69.166.116.10.5276 > 67.205.184.200.22: Flags [.], ack 15952, win 508, length 0
00:17:57.284432 IP 67.205.184.200.22 > 69.166.116.10.5276: Flags [P.], seq 17376:18664, ack 1, win 501, length 1288
00:17:57.295170 IP 69.166.116.10.5276 > 67.205.184.200.22: Flags [.], ack 16120, win 513, length 0
00:17:57.295200 IP 67.205.184.200.22 > 69.166.116.10.5276: Flags [P.], seq 18664:19024, ack 1, win 501, length 360
00:17:57.295316 IP 67.205.184.200.22 > 69.166.116.10.5276: Flags [P.], seq 19024:19156, ack 1, win 501, length 132
00:17:57.296028 IP 69.166.116.10.5276 > 67.205.184.200.22: Flags [.], ack 17340, win 508, length 0
00:17:57.296056 IP 67.205.184.200.22 > 69.166.116.10.5276: Flags [P.], seq 19156:19560, ack 1, win 501, length 404
00:17:57.296171 IP 67.205.184.200.22 > 69.166.116.10.5276: Flags [P.], seq 19560:19692, ack 1, win 501, length 132
00:17:57.296212 IP 67.205.184.200.22 > 69.166.116.10.5276: Flags [P.], seq 19692:19728, ack 1, win 501, length 36
00:17:57.296250 IP 67.205.184.200.22 > 69.166.116.10.5276: Flags [P.], seq 19728:19876, ack 1, win 501, length 148
00:17:57.296275 IP 67.205.184.200.22 > 69.166.116.10.5276: Flags [P.], seq 19876:19912, ack 1, win 501, length 36
00:17:57.296307 IP 67.205.184.200.22 > 69.166.116.10.5276: Flags [P.], seq 19912:20060, ack 1, win 501, length 148
00:17:57.296331 IP 67.205.184.200.22 > 69.166.116.10.5276: Flags [P.], seq 20060:20096, ack 1, win 501, length 36
00:17:57.296363 IP 67.205.184.200.22 > 69.166.116.10.5276: Flags [P.], seq 20096:20244, ack 1, win 501, length 148
00:17:57.297775 IP 69.166.116.10.5276 > 67.205.184.200.22: Flags [.], ack 18664, win 513, length 0
00:17:57.297791 IP 67.205.184.200.22 > 69.166.116.10.5276: Flags [P.], seq 20244:21200, ack 1, win 501, length 956
00:17:57.297876 IP 67.205.184.200.22 > 69.166.116.10.5276: Flags [P.], seq 21200:21332, ack 1, win 501, length 132
00:17:57.307930 IP 69.166.116.10.5276 > 67.205.184.200.22: Flags [.], ack 19156, win 511, length 0
00:17:57.307957 IP 67.205.184.200.22 > 69.166.116.10.5276: Flags [P.], seq 21332:21736, ack 1, win 501, length 404
00:17:57.308054 IP 67.205.184.200.22 > 69.166.116.10.5276: Flags [P.], seq 21736:21868, ack 1, win 501, length 132
00:17:57.309290 IP 69.166.116.10.5276 > 67.205.184.200.22: Flags [.], ack 19692, win 509, length 0
00:17:57.309298 IP 67.205.184.200.22 > 69.166.116.10.5276: Flags [P.], seq 21868:22272, ack 1, win 501, length 404
00:17:57.309339 IP 67.205.184.200.22 > 69.166.116.10.5276: Flags [P.], seq 22272:22404, ack 1, win 501, length 132
00:17:57.309989 IP 69.166.116.10.5276 > 67.205.184.200.22: Flags [.], ack 20244, win 513, length 0
00:17:57.310003 IP 67.205.184.200.22 > 69.166.116.10.5276: Flags [P.], seq 22404:22808, ack 1, win 501, length 404
00:17:57.310056 IP 67.205.184.200.22 > 69.166.116.10.5276: Flags [P.], seq 22808:22940, ack 1, win 501, length 132
00:17:57.310085 IP 67.205.184.200.22 > 69.166.116.10.5276: Flags [P.], seq 22940:22976, ack 1, win 501, length 36
00:17:57.310117 IP 67.205.184.200.22 > 69.166.116.10.5276: Flags [P.], seq 22976:23124, ack 1, win 501, length 148
00:17:57.310141 IP 67.205.184.200.22 > 69.166.116.10.5276: Flags [P.], seq 23124:23160, ack 1, win 501, length 36
00:17:57.310171 IP 67.205.184.200.22 > 69.166.116.10.5276: Flags [P.], seq 23160:23308, ack 1, win 501, length 148
00:17:57.310866 IP 69.166.116.10.5276 > 67.205.184.200.22: Flags [.], ack 21332, win 509, length 0
00:17:57.310873 IP 67.205.184.200.22 > 69.166.116.10.5276: Flags [P.], seq 23308:24080, ack 1, win 501, length 772
00:17:57.310909 IP 67.205.184.200.22 > 69.166.116.10.5276: Flags [P.], seq 24080:24212, ack 1, win 501, length 132
00:17:57.310938 IP 67.205.184.200.22 > 69.166.116.10.5276: Flags [P.], seq 24212:24248, ack 1, win 501, length 36
00:17:57.313375 IP 221.181.185.159.24513 > 67.205.184.200.22: Flags [P.], seq 2367432410:2367432506, ack 1686047969, win 262, options [nop,nop,TS val 10055980 ecr 937842603], length 96
00:17:57.313388 IP 67.205.184.200.22 > 221.181.185.159.24513: Flags [.], ack 96, win 504, options [nop,nop,TS val 937842880 ecr 10055980], length 0
00:17:57.320757 IP 69.166.116.10.5276 > 67.205.184.200.22: Flags [.], ack 21868, win 513, length 0
00:17:57.320772 IP 67.205.184.200.22 > 69.166.116.10.5276: Flags [P.], seq 24248:25280, ack 1, win 501, length 1032
00:17:57.320836 IP 67.205.184.200.22 > 69.166.116.10.5276: Flags [P.], seq 25280:25532, ack 1, win 501, length 252
00:17:57.322806 IP 69.166.116.10.5276 > 67.205.184.200.22: Flags [.], ack 22404, win 511, length 0
00:17:57.322819 IP 67.205.184.200.22 > 69.166.116.10.5276: Flags [P.], seq 25532:25688, ack 1, win 501, length 156
00:17:57.322830 IP 69.166.116.10.5276 > 67.205.184.200.22: Flags [.], ack 22976, win 508, length 0
00:17:57.322888 IP 67.205.184.200.22 > 69.166.116.10.5276: Flags [P.], seq 25688:26044, ack 1, win 501, length 356
00:17:57.322928 IP 67.205.184.200.22 > 69.166.116.10.5276: Flags [P.], seq 26044:26200, ack 1, win 501, length 156
00:17:57.322970 IP 67.205.184.200.22 > 69.166.116.10.5276: Flags [P.], seq 26200:26356, ack 1, win 501, length 156
00:17:57.323013 IP 67.205.184.200.22 > 69.166.116.10.5276: Flags [P.], seq 26356:26512, ack 1, win 501, length 156
00:17:57.323822 IP 69.166.116.10.5276 > 67.205.184.200.22: Flags [.], ack 23308, win 507, length 0
00:17:57.323823 IP 69.166.116.10.5276 > 67.205.184.200.22: Flags [.], ack 24248, win 513, length 0
00:17:57.323830 IP 67.205.184.200.22 > 69.166.116.10.5276: Flags [P.], seq 26512:26668, ack 1, win 501, length 156
00:17:57.323876 IP 67.205.184.200.22 > 69.166.116.10.5276: Flags [P.], seq 26668:27024, ack 1, win 501, length 356
00:17:57.323919 IP 67.205.184.200.22 > 69.166.116.10.5276: Flags [P.], seq 27024:27172, ack 1, win 501, length 148
00:17:57.323946 IP 67.205.184.200.22 > 69.166.116.10.5276: Flags [P.], seq 27172:27208, ack 1, win 501, length 36
00:17:57.323977 IP 67.205.184.200.22 > 69.166.116.10.5276: Flags [P.], seq 27208:27356, ack 1, win 501, length 148
00:17:57.324005 IP 67.205.184.200.22 > 69.166.116.10.5276: Flags [P.], seq 27356:27392, ack 1, win 501, length 36
00:17:57.324036 IP 67.205.184.200.22 > 69.166.116.10.5276: Flags [P.], seq 27392:27540, ack 1, win 501, length 148
00:17:57.333692 IP 69.166.116.10.5276 > 67.205.184.200.22: Flags [.], ack 25280, win 509, length 0
00:17:57.333712 IP 67.205.184.200.22 > 69.166.116.10.5276: Flags [P.], seq 27540:28128, ack 1, win 501, length 588
00:17:57.336592 IP 69.166.116.10.5276 > 67.205.184.200.22: Flags [.], ack 25688, win 507, length 0
00:17:57.336600 IP 67.205.184.200.22 > 69.166.116.10.5276: Flags [P.], seq 28128:28480, ack 1, win 501, length 352
00:17:57.336649 IP 67.205.184.200.22 > 69.166.116.10.5276: Flags [P.], seq 28480:28612, ack 1, win 501, length 132
00:17:57.337215 IP 69.166.116.10.5276 > 67.205.184.200.22: Flags [.], ack 26512, win 513, length 0
00:17:57.337222 IP 67.205.184.200.22 > 69.166.116.10.5276: Flags [P.], seq 28612:29016, ack 1, win 501, length 404
00:17:57.337260 IP 67.205.184.200.22 > 69.166.116.10.5276: Flags [P.], seq 29016:29148, ack 1, win 501, length 132
00:17:57.337288 IP 67.205.184.200.22 > 69.166.116.10.5276: Flags [P.], seq 29148:29184, ack 1, win 501, length 36
00:17:57.337320 IP 67.205.184.200.22 > 69.166.116.10.5276: Flags [P.], seq 29184:29332, ack 1, win 501, length 148
00:17:57.338007 IP 69.166.116.10.5276 > 67.205.184.200.22: Flags [.], ack 27540, win 509, length 0
00:17:57.338013 IP 67.205.184.200.22 > 69.166.116.10.5276: Flags [P.], seq 29332:29920, ack 1, win 501, length 588
00:17:57.338050 IP 67.205.184.200.22 > 69.166.116.10.5276: Flags [P.], seq 29920:30052, ack 1, win 501, length 132
00:17:57.338078 IP 67.205.184.200.22 > 69.166.116.10.5276: Flags [P.], seq 30052:30088, ack 1, win 501, length 36
00:17:57.338111 IP 67.205.184.200.22 > 69.166.116.10.5276: Flags [P.], seq 30088:30236, ack 1, win 501, length 148
00:17:57.338135 IP 67.205.184.200.22 > 69.166.116.10.5276: Flags [P.], seq 30236:30272, ack 1, win 501, length 36
00:17:57.338166 IP 67.205.184.200.22 > 69.166.116.10.5276: Flags [P.], seq 30272:30420, ack 1, win 501, length 148
00:17:57.338195 IP 67.205.184.200.22 > 69.166.116.10.5276: Flags [P.], seq 30420:30456, ack 1, win 501, length 36
00:17:57.347120 IP 69.166.116.10.5276 > 67.205.184.200.22: Flags [.], ack 28128, win 513, length 0
00:17:57.347150 IP 67.205.184.200.22 > 69.166.116.10.5276: Flags [P.], seq 30456:31376, ack 1, win 501, length 920
00:17:57.349316 IP 69.166.116.10.5276 > 67.205.184.200.22: Flags [.], ack 28612, win 511, length 0
00:17:57.349316 IP 69.166.116.10.5276 > 67.205.184.200.22: Flags [P.], seq 1:37, ack 28612, win 511, length 36
00:17:57.349331 IP 67.205.184.200.22 > 69.166.116.10.5276: Flags [P.], seq 31376:31728, ack 1, win 501, length 352
00:17:57.349371 IP 67.205.184.200.22 > 69.166.116.10.5276: Flags [.], ack 37, win 501, length 0
00:17:57.349420 IP 67.205.184.200.22 > 69.166.116.10.5276: Flags [P.], seq 31728:31860, ack 37, win 501, length 132
00:17:57.350730 IP 69.166.116.10.5276 > 67.205.184.200.22: Flags [.], ack 29332, win 508, length 0
00:17:57.350738 IP 67.205.184.200.22 > 69.166.116.10.5276: Flags [P.], seq 31860:32624, ack 37, win 501, length 764
00:17:57.350775 IP 67.205.184.200.22 > 69.166.116.10.5276: Flags [P.], seq 32624:32756, ack 37, win 501, length 132
00:17:57.350802 IP 67.205.184.200.22 > 69.166.116.10.5276: Flags [P.], seq 32756:32792, ack 37, win 501, length 36
00:17:57.350833 IP 67.205.184.200.22 > 69.166.116.10.5276: Flags [P.], seq 32792:32948, ack 37, win 501, length 156
00:17:57.352363 IP 69.166.116.10.5276 > 67.205.184.200.22: Flags [.], ack 30420, win 513, length 0
00:17:57.352374 IP 67.205.184.200.22 > 69.166.116.10.5276: Flags [P.], seq 32948:33552, ack 37, win 501, length 604
00:17:57.352428 IP 67.205.184.200.22 > 69.166.116.10.5276: Flags [P.], seq 33552:33684, ack 37, win 501, length 132
00:17:57.352459 IP 67.205.184.200.22 > 69.166.116.10.5276: Flags [P.], seq 33684:33720, ack 37, win 501, length 36
00:17:57.352494 IP 67.205.184.200.22 > 69.166.116.10.5276: Flags [P.], seq 33720:33876, ack 37, win 501, length 156
00:17:57.352530 IP 67.205.184.200.22 > 69.166.116.10.5276: Flags [P.], seq 33876:33912, ack 37, win 501, length 36
00:17:57.352570 IP 67.205.184.200.22 > 69.166.116.10.5276: Flags [P.], seq 33912:34068, ack 37, win 501, length 156
00:17:57.359868 IP 69.166.116.10.5276 > 67.205.184.200.22: Flags [.], ack 31376, win 509, length 0
00:17:57.359893 IP 67.205.184.200.22 > 69.166.116.10.5276: Flags [P.], seq 34068:34856, ack 37, win 501, length 788
00:17:57.360023 IP 67.205.184.200.22 > 69.166.116.10.5276: Flags [P.], seq 34856:34988, ack 37, win 501, length 132
00:17:57.362504 IP 69.166.116.10.5276 > 67.205.184.200.22: Flags [.], ack 31860, win 507, length 0
00:17:57.362521 IP 67.205.184.200.22 > 69.166.116.10.5276: Flags [P.], seq 34988:35408, ack 37, win 501, length 420
00:17:57.362599 IP 67.205.184.200.22 > 69.166.116.10.5276: Flags [P.], seq 35408:35540, ack 37, win 501, length 132
00:17:57.367010 IP 69.166.116.10.5276 > 67.205.184.200.22: Flags [.], ack 32948, win 513, length 0
00:17:57.367032 IP 67.205.184.200.22 > 69.166.116.10.5276: Flags [P.], seq 35540:35960, ack 37, win 501, length 420
00:17:57.367112 IP 67.205.184.200.22 > 69.166.116.10.5276: Flags [P.], seq 35960:36092, ack 37, win 501, length 132
00:17:57.367147 IP 67.205.184.200.22 > 69.166.116.10.5276: Flags [P.], seq 36092:36128, ack 37, win 501, length 36
00:17:57.367181 IP 67.205.184.200.22 > 69.166.116.10.5276: Flags [P.], seq 36128:36284, ack 37, win 501, length 156
00:17:57.367206 IP 67.205.184.200.22 > 69.166.116.10.5276: Flags [P.], seq 36284:36320, ack 37, win 501, length 36
00:17:57.367784 IP 69.166.116.10.5276 > 67.205.184.200.22: Flags [.], ack 34068, win 508, length 0
00:17:57.367792 IP 67.205.184.200.22 > 69.166.116.10.5276: Flags [P.], seq 36320:37072, ack 37, win 501, length 752
00:17:57.367830 IP 67.205.184.200.22 > 69.166.116.10.5276: Flags [P.], seq 37072:37204, ack 37, win 501, length 132
00:17:57.367858 IP 67.205.184.200.22 > 69.166.116.10.5276: Flags [P.], seq 37204:37240, ack 37, win 501, length 36
00:17:57.367889 IP 67.205.184.200.22 > 69.166.116.10.5276: Flags [P.], seq 37240:37396, ack 37, win 501, length 156
00:17:57.367925 IP 67.205.184.200.22 > 69.166.116.10.5276: Flags [P.], seq 37396:37432, ack 37, win 501, length 36
00:17:57.367956 IP 67.205.184.200.22 > 69.166.116.10.5276: Flags [P.], seq 37432:37588, ack 37, win 501, length 156
00:17:57.373055 IP 69.166.116.10.5276 > 67.205.184.200.22: Flags [.], ack 34988, win 513, length 0
00:17:57.373072 IP 67.205.184.200.22 > 69.166.116.10.5276: Flags [P.], seq 37588:38376, ack 37, win 501, length 788
00:17:57.373147 IP 67.205.184.200.22 > 69.166.116.10.5276: Flags [P.], seq 38376:38508, ack 37, win 501, length 132
00:17:57.378714 IP 69.166.116.10.5276 > 67.205.184.200.22: Flags [.], ack 34988, win 513, options [nop,nop,sack 1 {35408:35540}], length 0
00:17:57.378737 IP 67.205.184.200.22 > 69.166.116.10.5276: Flags [P.], seq 38508:38928, ack 37, win 501, length 420
00:17:57.380562 IP 69.166.116.10.5276 > 67.205.184.200.22: Flags [.], ack 34988, win 513, options [nop,nop,sack 1 {35408:35960}], length 0
00:17:57.380562 IP 69.166.116.10.5276 > 67.205.184.200.22: Flags [.], ack 34988, win 513, options [nop,nop,sack 1 {35408:36092}], length 0
00:17:57.380579 IP 67.205.184.200.22 > 69.166.116.10.5276: Flags [P.], seq 38928:39328, ack 37, win 501, length 400
00:17:57.380596 IP 67.205.184.200.22 > 69.166.116.10.5276: Flags [P.], seq 34988:35408, ack 37, win 501, length 420
00:17:57.380614 IP 69.166.116.10.5276 > 67.205.184.200.22: Flags [.], ack 34988, win 513, options [nop,nop,sack 1 {35408:36128}], length 0
00:17:57.380614 IP 69.166.116.10.5276 > 67.205.184.200.22: Flags [.], ack 34988, win 513, options [nop,nop,sack 1 {35408:36284}], length 0
00:17:57.380672 IP 67.205.184.200.22 > 69.166.116.10.5276: Flags [P.], seq 39328:39500, ack 37, win 501, length 172
00:17:57.381245 IP 69.166.116.10.5276 > 67.205.184.200.22: Flags [.], ack 34988, win 513, options [nop,nop,sack 1 {35408:36320}], length 0
00:17:57.381245 IP 69.166.116.10.5276 > 67.205.184.200.22: Flags [.], ack 34988, win 513, options [nop,nop,sack 1 {35408:37072}], length 0
00:17:57.381252 IP 67.205.184.200.22 > 69.166.116.10.5276: Flags [P.], seq 39500:40736, ack 37, win 501, length 1236
00:17:57.381298 IP 69.166.116.10.5276 > 67.205.184.200.22: Flags [.], ack 34988, win 513, options [nop,nop,sack 1 {35408:37204}], length 0
00:17:57.381302 IP 67.205.184.200.22 > 69.166.116.10.5276: Flags [P.], seq 40736:40908, ack 37, win 501, length 172
00:17:57.381903 IP 69.166.116.10.5276 > 67.205.184.200.22: Flags [.], ack 34988, win 513, options [nop,nop,sack 1 {35408:37240}], length 0
00:17:57.381908 IP 67.205.184.200.22 > 69.166.116.10.5276: Flags [P.], seq 40908:41744, ack 37, win 501, length 836
00:17:57.381975 IP 69.166.116.10.5276 > 67.205.184.200.22: Flags [.], ack 34988, win 513, options [nop,nop,sack 1 {35408:37396}], length 0
00:17:57.381986 IP 67.205.184.200.22 > 69.166.116.10.5276: Flags [P.], seq 41744:41916, ack 37, win 501, length 172
00:17:57.382016 IP 69.166.116.10.5276 > 67.205.184.200.22: Flags [.], ack 34988, win 513, options [nop,nop,sack 1 {35408:37432}], length 0
00:17:57.382016 IP 69.166.116.10.5276 > 67.205.184.200.22: Flags [.], ack 34988, win 513, options [nop,nop,sack 1 {35408:37588}], length 0
00:17:57.387561 IP 69.166.116.10.5276 > 67.205.184.200.22: Flags [.], ack 34988, win 513, options [nop,nop,sack 1 {35408:38376}], length 0
00:17:57.387562 IP 69.166.116.10.5276 > 67.205.184.200.22: Flags [.], ack 34988, win 513, options [nop,nop,sack 1 {35408:38508}], length 0
00:17:57.387583 IP 67.205.184.200.22 > 69.166.116.10.5276: Flags [P.], seq 41916:42960, ack 37, win 501, length 1044
00:17:57.387670 IP 67.205.184.200.22 > 69.166.116.10.5276: Flags [P.], seq 42960:43132, ack 37, win 501, length 172
00:17:57.393199 IP 69.166.116.10.5276 > 67.205.184.200.22: Flags [.], ack 34988, win 513, options [nop,nop,sack 1 {35408:38928}], length 0
00:17:57.393216 IP 67.205.184.200.22 > 69.166.116.10.5276: Flags [P.], seq 43132:43760, ack 37, win 501, length 628
00:17:57.393809 IP 69.166.116.10.5276 > 67.205.184.200.22: Flags [.], ack 34988, win 513, options [nop,nop,sack 1 {35408:39328}], length 0
00:17:57.393817 IP 67.205.184.200.22 > 69.166.116.10.5276: Flags [P.], seq 43760:44160, ack 37, win 501, length 400
00:17:57.396927 IP 69.166.116.10.5276 > 67.205.184.200.22: Flags [.], ack 39328, win 513, length 0
00:17:57.396927 IP 69.166.116.10.5276 > 67.205.184.200.22: Flags [.], ack 41916, win 513, length 0
00:17:57.396956 IP 67.205.184.200.22 > 69.166.116.10.5276: Flags [P.], seq 44160:44560, ack 37, win 501, length 400
00:17:57.397037 IP 67.205.184.200.22 > 69.166.116.10.5276: Flags [P.], seq 44560:44692, ack 37, win 501, length 132
00:17:57.397068 IP 67.205.184.200.22 > 69.166.116.10.5276: Flags [P.], seq 44692:44728, ack 37, win 501, length 36
00:17:57.397102 IP 67.205.184.200.22 > 69.166.116.10.5276: Flags [P.], seq 44728:44860, ack 37, win 501, length 132
00:17:57.397126 IP 67.205.184.200.22 > 69.166.116.10.5276: Flags [P.], seq 44860:44896, ack 37, win 501, length 36
00:17:57.397178 IP 67.205.184.200.22 > 69.166.116.10.5276: Flags [P.], seq 44896:45052, ack 37, win 501, length 156
00:17:57.399967 IP 69.166.116.10.5276 > 67.205.184.200.22: Flags [.], ack 42960, win 509, length 0
00:17:57.399986 IP 67.205.184.200.22 > 69.166.116.10.5276: Flags [P.], seq 45052:46032, ack 37, win 501, length 980
00:17:57.405842 IP 69.166.116.10.5276 > 67.205.184.200.22: Flags [.], ack 43760, win 513, length 0
00:17:57.405858 IP 67.205.184.200.22 > 69.166.116.10.5276: Flags [P.], seq 46032:46392, ack 37, win 501, length 360
00:17:57.405930 IP 67.205.184.200.22 > 69.166.116.10.5276: Flags [P.], seq 46392:46524, ack 37, win 501, length 132
00:17:57.409646 IP 69.166.116.10.5276 > 67.205.184.200.22: Flags [.], ack 44560, win 510, length 0
00:17:57.409662 IP 67.205.184.200.22 > 69.166.116.10.5276: Flags [P.], seq 46524:46944, ack 37, win 501, length 420
00:17:57.409737 IP 67.205.184.200.22 > 69.166.116.10.5276: Flags [P.], seq 46944:47076, ack 37, win 501, length 132
00:17:57.409772 IP 67.205.184.200.22 > 69.166.116.10.5276: Flags [P.], seq 47076:47112, ack 37, win 501, length 36
00:17:57.410830 IP 69.166.116.10.5276 > 67.205.184.200.22: Flags [.], ack 45052, win 508, length 0
00:17:57.410843 IP 67.205.184.200.22 > 69.166.116.10.5276: Flags [P.], seq 47112:47680, ack 37, win 501, length 568
00:17:57.410892 IP 67.205.184.200.22 > 69.166.116.10.5276: Flags [P.], seq 47680:47812, ack 37, win 501, length 132
00:17:57.410937 IP 67.205.184.200.22 > 69.166.116.10.5276: Flags [P.], seq 47812:47848, ack 37, win 501, length 36
00:17:57.410980 IP 67.205.184.200.22 > 69.166.116.10.5276: Flags [P.], seq 47848:48004, ack 37, win 501, length 156
00:17:57.411006 IP 67.205.184.200.22 > 69.166.116.10.5276: Flags [P.], seq 48004:48040, ack 37, win 501, length 36
00:17:57.412559 IP 69.166.116.10.5276 > 67.205.184.200.22: Flags [.], ack 46032, win 513, length 0
00:17:57.412569 IP 67.205.184.200.22 > 69.166.116.10.5276: Flags [P.], seq 48040:48792, ack 37, win 501, length 752
00:17:57.418584 IP 69.166.116.10.5276 > 67.205.184.200.22: Flags [.], ack 46524, win 511, length 0
00:17:57.418604 IP 67.205.184.200.22 > 69.166.116.10.5276: Flags [P.], seq 48792:49152, ack 37, win 501, length 360
00:17:57.418698 IP 67.205.184.200.22 > 69.166.116.10.5276: Flags [P.], seq 49152:49284, ack 37, win 501, length 132
00:17:57.422609 IP 69.166.116.10.5276 > 67.205.184.200.22: Flags [.], ack 47076, win 509, length 0
00:17:57.422625 IP 67.205.184.200.22 > 69.166.116.10.5276: Flags [P.], seq 49284:49704, ack 37, win 501, length 420
00:17:57.422707 IP 67.205.184.200.22 > 69.166.116.10.5276: Flags [P.], seq 49704:49836, ack 37, win 501, length 132
00:17:57.424204 IP 69.166.116.10.5276 > 67.205.184.200.22: Flags [.], ack 48004, win 513, length 0
00:17:57.424221 IP 67.205.184.200.22 > 69.166.116.10.5276: Flags [P.], seq 49836:50256, ack 37, win 501, length 420
00:17:57.424292 IP 67.205.184.200.22 > 69.166.116.10.5276: Flags [P.], seq 50256:50388, ack 37, win 501, length 132
00:17:57.424327 IP 67.205.184.200.22 > 69.166.116.10.5276: Flags [P.], seq 50388:50424, ack 37, win 501, length 36
00:17:57.424363 IP 67.205.184.200.22 > 69.166.116.10.5276: Flags [P.], seq 50424:50580, ack 37, win 501, length 156
00:17:57.424389 IP 67.205.184.200.22 > 69.166.116.10.5276: Flags [P.], seq 50580:50616, ack 37, win 501, length 36
00:17:57.424643 IP 69.166.116.10.5276 > 67.205.184.200.22: Flags [.], ack 48040, win 513, length 0
00:17:57.424649 IP 67.205.184.200.22 > 69.166.116.10.5276: Flags [P.], seq 50616:51368, ack 37, win 501, length 752
00:17:57.431603 IP 69.166.116.10.5276 > 67.205.184.200.22: Flags [.], ack 49152, win 508, length 0
00:17:57.431628 IP 67.205.184.200.22 > 69.166.116.10.5276: Flags [P.], seq 51368:51728, ack 37, win 501, length 360
00:17:57.431725 IP 67.205.184.200.22 > 69.166.116.10.5276: Flags [P.], seq 51728:51860, ack 37, win 501, length 132
00:17:57.436506 IP 69.166.116.10.5276 > 67.205.184.200.22: Flags [.], ack 49704, win 513, length 0
00:17:57.436524 IP 67.205.184.200.22 > 69.166.116.10.5276: Flags [P.], seq 51860:52280, ack 37, win 501, length 420
00:17:57.436611 IP 67.205.184.200.22 > 69.166.116.10.5276: Flags [P.], seq 52280:52412, ack 37, win 501, length 132
00:17:57.439117 IP 69.166.116.10.5276 > 67.205.184.200.22: Flags [.], ack 50256, win 511, length 0
00:17:57.439134 IP 67.205.184.200.22 > 69.166.116.10.5276: Flags [P.], seq 52412:52832, ack 37, win 501, length 420
00:17:57.439211 IP 67.205.184.200.22 > 69.166.116.10.5276: Flags [P.], seq 52832:52964, ack 37, win 501, length 132
00:17:57.439926 IP 69.166.116.10.5276 > 67.205.184.200.22: Flags [.], ack 51368, win 513, length 0
00:17:57.439934 IP 67.205.184.200.22 > 69.166.116.10.5276: Flags [P.], seq 52964:53384, ack 37, win 501, length 420
00:17:57.439973 IP 67.205.184.200.22 > 69.166.116.10.5276: Flags [P.], seq 53384:53516, ack 37, win 501, length 132
00:17:57.440000 IP 67.205.184.200.22 > 69.166.116.10.5276: Flags [P.], seq 53516:53552, ack 37, win 501, length 36
00:17:57.440042 IP 67.205.184.200.22 > 69.166.116.10.5276: Flags [P.], seq 53552:53708, ack 37, win 501, length 156
00:17:57.440068 IP 67.205.184.200.22 > 69.166.116.10.5276: Flags [P.], seq 53708:53744, ack 37, win 501, length 36
00:17:57.444459 IP 69.166.116.10.5276 > 67.205.184.200.22: Flags [.], ack 51728, win 511, length 0
00:17:57.444476 IP 67.205.184.200.22 > 69.166.116.10.5276: Flags [P.], seq 53744:54496, ack 37, win 501, length 752
00:17:57.449131 IP 69.166.116.10.5276 > 67.205.184.200.22: Flags [.], ack 52280, win 509, length 0
00:17:57.449150 IP 67.205.184.200.22 > 69.166.116.10.5276: Flags [P.], seq 54496:54856, ack 37, win 501, length 360
00:17:57.449235 IP 67.205.184.200.22 > 69.166.116.10.5276: Flags [P.], seq 54856:54988, ack 37, win 501, length 132
00:17:57.455190 IP 69.166.116.10.5276 > 67.205.184.200.22: Flags [.], ack 52964, win 513, length 0
00:17:57.455202 IP 69.166.116.10.5276 > 67.205.184.200.22: Flags [.], ack 53552, win 510, length 0
00:17:57.455202 IP 69.166.116.10.5276 > 67.205.184.200.22: Flags [.], ack 53744, win 510, length 0
00:17:57.455232 IP 67.205.184.200.22 > 69.166.116.10.5276: Flags [P.], seq 54988:55408, ack 37, win 501, length 420
00:17:57.455344 IP 67.205.184.200.22 > 69.166.116.10.5276: Flags [P.], seq 55408:55540, ack 37, win 501, length 132
00:17:57.455380 IP 67.205.184.200.22 > 69.166.116.10.5276: Flags [P.], seq 55540:55576, ack 37, win 501, length 36
00:17:57.455416 IP 67.205.184.200.22 > 69.166.116.10.5276: Flags [P.], seq 55576:55708, ack 37, win 501, length 132
00:17:57.455441 IP 67.205.184.200.22 > 69.166.116.10.5276: Flags [P.], seq 55708:55744, ack 37, win 501, length 36
00:17:57.455472 IP 67.205.184.200.22 > 69.166.116.10.5276: Flags [P.], seq 55744:55876, ack 37, win 501, length 132
00:17:57.455498 IP 67.205.184.200.22 > 69.166.116.10.5276: Flags [P.], seq 55876:55912, ack 37, win 501, length 36
00:17:57.455530 IP 67.205.184.200.22 > 69.166.116.10.5276: Flags [P.], seq 55912:56068, ack 37, win 501, length 156
00:17:57.461863 IP 69.166.116.10.5276 > 67.205.184.200.22: Flags [.], ack 54856, win 513, length 0
00:17:57.461893 IP 67.205.184.200.22 > 69.166.116.10.5276: Flags [P.], seq 56068:57424, ack 37, win 501, length 1356
00:17:57.461988 IP 67.205.184.200.22 > 69.166.116.10.5276: Flags [P.], seq 57424:57556, ack 37, win 501, length 132
00:17:57.468653 IP 69.166.116.10.5276 > 67.205.184.200.22: Flags [.], ack 55408, win 511, length 0
00:17:57.468653 IP 69.166.116.10.5276 > 67.205.184.200.22: Flags [.], ack 56068, win 508, length 0
00:17:57.468673 IP 67.205.184.200.22 > 69.166.116.10.5276: Flags [P.], seq 57556:57976, ack 37, win 501, length 420
00:17:57.468754 IP 67.205.184.200.22 > 69.166.116.10.5276: Flags [P.], seq 57976:58108, ack 37, win 501, length 132
00:17:57.468788 IP 67.205.184.200.22 > 69.166.116.10.5276: Flags [P.], seq 58108:58144, ack 37, win 501, length 36
00:17:57.468821 IP 67.205.184.200.22 > 69.166.116.10.5276: Flags [P.], seq 58144:58276, ack 37, win 501, length 132
00:17:57.468847 IP 67.205.184.200.22 > 69.166.116.10.5276: Flags [P.], seq 58276:58312, ack 37, win 501, length 36
00:17:57.468879 IP 67.205.184.200.22 > 69.166.116.10.5276: Flags [P.], seq 58312:58468, ack 37, win 501, length 156
00:17:57.468906 IP 67.205.184.200.22 > 69.166.116.10.5276: Flags [P.], seq 58468:58504, ack 37, win 501, length 36
00:17:57.468937 IP 67.205.184.200.22 > 69.166.116.10.5276: Flags [P.], seq 58504:58660, ack 37, win 501, length 156
00:17:57.468962 IP 67.205.184.200.22 > 69.166.116.10.5276: Flags [P.], seq 58660:58696, ack 37, win 501, length 36
00:17:57.474784 IP 69.166.116.10.5276 > 67.205.184.200.22: Flags [.], ack 57424, win 513, length 0
00:17:57.474810 IP 67.205.184.200.22 > 69.166.116.10.5276: Flags [P.], seq 58696:60008, ack 37, win 501, length 1312
00:17:57.474902 IP 67.205.184.200.22 > 69.166.116.10.5276: Flags [P.], seq 60008:60140, ack 37, win 501, length 132
00:17:57.481553 IP 69.166.116.10.5276 > 67.205.184.200.22: Flags [.], ack 57976, win 511, length 0
00:17:57.481579 IP 67.205.184.200.22 > 69.166.116.10.5276: Flags [P.], seq 60140:60560, ack 37, win 501, length 420
00:17:57.481698 IP 67.205.184.200.22 > 69.166.116.10.5276: Flags [P.], seq 60560:60692, ack 37, win 501, length 132
00:17:57.482219 IP 69.166.116.10.5276 > 67.205.184.200.22: Flags [.], ack 58660, win 508, length 0
00:17:57.482229 IP 67.205.184.200.22 > 69.166.116.10.5276: Flags [P.], seq 60692:61112, ack 37, win 501, length 420
00:17:57.482268 IP 67.205.184.200.22 > 69.166.116.10.5276: Flags [P.], seq 61112:61244, ack 37, win 501, length 132
00:17:57.482295 IP 67.205.184.200.22 > 69.166.116.10.5276: Flags [P.], seq 61244:61280, ack 37, win 501, length 36
00:17:57.482326 IP 67.205.184.200.22 > 69.166.116.10.5276: Flags [P.], seq 61280:61436, ack 37, win 501, length 156
00:17:57.482350 IP 67.205.184.200.22 > 69.166.116.10.5276: Flags [P.], seq 61436:61472, ack 37, win 501, length 36
00:17:57.482381 IP 67.205.184.200.22 > 69.166.116.10.5276: Flags [P.], seq 61472:61628, ack 37, win 501, length 156
00:17:57.482405 IP 67.205.184.200.22 > 69.166.116.10.5276: Flags [P.], seq 61628:61664, ack 37, win 501, length 36
00:17:57.483707 IP 69.166.116.10.5276 > 67.205.184.200.22: Flags [.], ack 58696, win 508, length 0
00:17:57.483722 IP 67.205.184.200.22 > 69.166.116.10.5276: Flags [P.], seq 61664:62600, ack 37, win 501, length 936
00:17:57.489180 IP 69.166.116.10.5276 > 67.205.184.200.22: Flags [.], ack 60140, win 513, length 0
00:17:57.489199 IP 67.205.184.200.22 > 69.166.116.10.5276: Flags [P.], seq 62600:62960, ack 37, win 501, length 360
00:17:57.489281 IP 67.205.184.200.22 > 69.166.116.10.5276: Flags [P.], seq 62960:63092, ack 37, win 501, length 132
00:17:57.489315 IP 67.205.184.200.22 > 69.166.116.10.5276: Flags [P.], seq 63092:63128, ack 37, win 501, length 36
00:17:57.495827 IP 69.166.116.10.5276 > 67.205.184.200.22: Flags [.], ack 61628, win 513, length 0
00:17:57.495858 IP 67.205.184.200.22 > 69.166.116.10.5276: Flags [P.], seq 63128:63696, ack 37, win 501, length 568
00:17:57.495982 IP 67.205.184.200.22 > 69.166.116.10.5276: Flags [P.], seq 63696:63828, ack 37, win 501, length 132
00:17:57.496020 IP 67.205.184.200.22 > 69.166.116.10.5276: Flags [P.], seq 63828:63864, ack 37, win 501, length 36
00:17:57.496058 IP 67.205.184.200.22 > 69.166.116.10.5276: Flags [P.], seq 63864:64020, ack 37, win 501, length 156
