root@ubuntu-s-1vcpu-1gb-nyc1-01:~# tcpdump -i eth0 tcp
tcpdump: verbose output suppressed, use -v or -vv for full protocol decode
listening on eth0, link-type EN10MB (Ethernet), capture size 262144 bytes
00:18:36.374965 IP ubuntu-s-1vcpu-1gb-nyc1-01.ssh > 69.166.116.10.5276: Flags [P.], seq 4126032365:4126032401, ack 2999389042, win 501, length 36
00:18:36.375354 IP ubuntu-s-1vcpu-1gb-nyc1-01.ssh > 69.166.116.10.5276: Flags [P.], seq 36:144, ack 1, win 501, length 108
00:18:36.375396 IP ubuntu-s-1vcpu-1gb-nyc1-01.ssh > 69.166.116.10.5276: Flags [P.], seq 144:180, ack 1, win 501, length 36
00:18:36.375434 IP ubuntu-s-1vcpu-1gb-nyc1-01.ssh > 69.166.116.10.5276: Flags [P.], seq 180:288, ack 1, win 501, length 108
00:18:36.375463 IP ubuntu-s-1vcpu-1gb-nyc1-01.ssh > 69.166.116.10.5276: Flags [P.], seq 288:324, ack 1, win 501, length 36
00:18:36.378697 IP ubuntu-s-1vcpu-1gb-nyc1-01.ssh > 69.166.116.10.5276: Flags [P.], seq 324:504, ack 1, win 501, length 180
00:18:36.378737 IP ubuntu-s-1vcpu-1gb-nyc1-01.ssh > 69.166.116.10.5276: Flags [P.], seq 504:540, ack 1, win 501, length 36
00:18:36.378770 IP ubuntu-s-1vcpu-1gb-nyc1-01.ssh > 69.166.116.10.5276: Flags [P.], seq 540:696, ack 1, win 501, length 156
00:18:36.378826 IP ubuntu-s-1vcpu-1gb-nyc1-01.ssh > 69.166.116.10.5276: Flags [P.], seq 696:924, ack 1, win 501, length 228
00:18:36.378854 IP ubuntu-s-1vcpu-1gb-nyc1-01.ssh > 69.166.116.10.5276: Flags [P.], seq 924:1088, ack 1, win 501, length 164
00:18:36.388397 IP 69.166.116.10.5276 > ubuntu-s-1vcpu-1gb-nyc1-01.ssh: Flags [.], ack 288, win 513, length 0
00:18:36.388420 IP ubuntu-s-1vcpu-1gb-nyc1-01.ssh > 69.166.116.10.5276: Flags [P.], seq 1088:2308, ack 1, win 501, length 1220
00:18:36.388509 IP ubuntu-s-1vcpu-1gb-nyc1-01.ssh > 69.166.116.10.5276: Flags [P.], seq 2308:2456, ack 1, win 501, length 148
00:18:36.388542 IP ubuntu-s-1vcpu-1gb-nyc1-01.ssh > 69.166.116.10.5276: Flags [P.], seq 2456:2492, ack 1, win 501, length 36
00:18:36.388577 IP ubuntu-s-1vcpu-1gb-nyc1-01.ssh > 69.166.116.10.5276: Flags [P.], seq 2492:2656, ack 1, win 501, length 164
00:18:36.388603 IP ubuntu-s-1vcpu-1gb-nyc1-01.ssh > 69.166.116.10.5276: Flags [P.], seq 2656:2692, ack 1, win 501, length 36
00:18:36.388634 IP ubuntu-s-1vcpu-1gb-nyc1-01.ssh > 69.166.116.10.5276: Flags [P.], seq 2692:2856, ack 1, win 501, length 164
00:18:36.388660 IP ubuntu-s-1vcpu-1gb-nyc1-01.ssh > 69.166.116.10.5276: Flags [P.], seq 2856:2892, ack 1, win 501, length 36
00:18:36.388692 IP ubuntu-s-1vcpu-1gb-nyc1-01.ssh > 69.166.116.10.5276: Flags [P.], seq 2892:3056, ack 1, win 501, length 164
00:18:36.393192 IP 69.166.116.10.5276 > ubuntu-s-1vcpu-1gb-nyc1-01.ssh: Flags [.], ack 1088, win 510, length 0
00:18:36.393211 IP ubuntu-s-1vcpu-1gb-nyc1-01.ssh > 69.166.116.10.5276: Flags [P.], seq 3056:4092, ack 1, win 501, length 1036
00:18:36.393289 IP ubuntu-s-1vcpu-1gb-nyc1-01.ssh > 69.166.116.10.5276: Flags [P.], seq 4092:4240, ack 1, win 501, length 148
00:18:36.393324 IP ubuntu-s-1vcpu-1gb-nyc1-01.ssh > 69.166.116.10.5276: Flags [P.], seq 4240:4276, ack 1, win 501, length 36
00:18:36.393360 IP ubuntu-s-1vcpu-1gb-nyc1-01.ssh > 69.166.116.10.5276: Flags [P.], seq 4276:4440, ack 1, win 501, length 164
00:18:36.393386 IP ubuntu-s-1vcpu-1gb-nyc1-01.ssh > 69.166.116.10.5276: Flags [P.], seq 4440:4476, ack 1, win 501, length 36
00:18:36.393417 IP ubuntu-s-1vcpu-1gb-nyc1-01.ssh > 69.166.116.10.5276: Flags [P.], seq 4476:4640, ack 1, win 501, length 164
00:18:36.393443 IP ubuntu-s-1vcpu-1gb-nyc1-01.ssh > 69.166.116.10.5276: Flags [P.], seq 4640:4676, ack 1, win 501, length 36
00:18:36.393474 IP ubuntu-s-1vcpu-1gb-nyc1-01.ssh > 69.166.116.10.5276: Flags [P.], seq 4676:4840, ack 1, win 501, length 164
00:18:36.393500 IP ubuntu-s-1vcpu-1gb-nyc1-01.ssh > 69.166.116.10.5276: Flags [P.], seq 4840:4876, ack 1, win 501, length 36
00:18:36.393531 IP ubuntu-s-1vcpu-1gb-nyc1-01.ssh > 69.166.116.10.5276: Flags [P.], seq 4876:5040, ack 1, win 501, length 164
00:18:36.393557 IP ubuntu-s-1vcpu-1gb-nyc1-01.ssh > 69.166.116.10.5276: Flags [P.], seq 5040:5076, ack 1, win 501, length 36
00:18:36.393589 IP ubuntu-s-1vcpu-1gb-nyc1-01.ssh > 69.166.116.10.5276: Flags [P.], seq 5076:5240, ack 1, win 501, length 164
00:18:36.401709 IP 69.166.116.10.5276 > ubuntu-s-1vcpu-1gb-nyc1-01.ssh: Flags [.], ack 3056, win 513, length 0
00:18:36.401751 IP ubuntu-s-1vcpu-1gb-nyc1-01.ssh > 69.166.116.10.5276: Flags [P.], seq 5240:6676, ack 1, win 501, length 1436
00:18:36.401882 IP ubuntu-s-1vcpu-1gb-nyc1-01.ssh > 69.166.116.10.5276: Flags [P.], seq 6676:6824, ack 1, win 501, length 148
00:18:36.401920 IP ubuntu-s-1vcpu-1gb-nyc1-01.ssh > 69.166.116.10.5276: Flags [P.], seq 6824:6860, ack 1, win 501, length 36
00:18:36.401961 IP ubuntu-s-1vcpu-1gb-nyc1-01.ssh > 69.166.116.10.5276: Flags [P.], seq 6860:7024, ack 1, win 501, length 164
00:18:36.401989 IP ubuntu-s-1vcpu-1gb-nyc1-01.ssh > 69.166.116.10.5276: Flags [P.], seq 7024:7060, ack 1, win 501, length 36
00:18:36.402022 IP ubuntu-s-1vcpu-1gb-nyc1-01.ssh > 69.166.116.10.5276: Flags [P.], seq 7060:7224, ack 1, win 501, length 164
00:18:36.402048 IP ubuntu-s-1vcpu-1gb-nyc1-01.ssh > 69.166.116.10.5276: Flags [P.], seq 7224:7260, ack 1, win 501, length 36
00:18:36.402080 IP ubuntu-s-1vcpu-1gb-nyc1-01.ssh > 69.166.116.10.5276: Flags [P.], seq 7260:7424, ack 1, win 501, length 164
00:18:36.402106 IP ubuntu-s-1vcpu-1gb-nyc1-01.ssh > 69.166.116.10.5276: Flags [P.], seq 7424:7460, ack 1, win 501, length 36
00:18:36.402138 IP ubuntu-s-1vcpu-1gb-nyc1-01.ssh > 69.166.116.10.5276: Flags [P.], seq 7460:7624, ack 1, win 501, length 164
00:18:36.402163 IP ubuntu-s-1vcpu-1gb-nyc1-01.ssh > 69.166.116.10.5276: Flags [P.], seq 7624:7660, ack 1, win 501, length 36
00:18:36.402195 IP ubuntu-s-1vcpu-1gb-nyc1-01.ssh > 69.166.116.10.5276: Flags [P.], seq 7660:7824, ack 1, win 501, length 164
00:18:36.402230 IP ubuntu-s-1vcpu-1gb-nyc1-01.ssh > 69.166.116.10.5276: Flags [P.], seq 7824:7860, ack 1, win 501, length 36
00:18:36.402261 IP ubuntu-s-1vcpu-1gb-nyc1-01.ssh > 69.166.116.10.5276: Flags [P.], seq 7860:8024, ack 1, win 501, length 164
00:18:36.402286 IP ubuntu-s-1vcpu-1gb-nyc1-01.ssh > 69.166.116.10.5276: Flags [P.], seq 8024:8060, ack 1, win 501, length 36
00:18:36.402317 IP ubuntu-s-1vcpu-1gb-nyc1-01.ssh > 69.166.116.10.5276: Flags [P.], seq 8060:8224, ack 1, win 501, length 164
00:18:36.408488 IP 69.166.116.10.5276 > ubuntu-s-1vcpu-1gb-nyc1-01.ssh: Flags [.], ack 5240, win 513, length 0
00:18:36.408528 IP ubuntu-s-1vcpu-1gb-nyc1-01.ssh > 69.166.116.10.5276: Flags [P.], seq 8224:10060, ack 1, win 501, length 1836
00:18:36.408648 IP ubuntu-s-1vcpu-1gb-nyc1-01.ssh > 69.166.116.10.5276: Flags [P.], seq 10060:10208, ack 1, win 501, length 148
00:18:36.408682 IP ubuntu-s-1vcpu-1gb-nyc1-01.ssh > 69.166.116.10.5276: Flags [P.], seq 10208:10244, ack 1, win 501, length 36
00:18:36.408718 IP ubuntu-s-1vcpu-1gb-nyc1-01.ssh > 69.166.116.10.5276: Flags [P.], seq 10244:10408, ack 1, win 501, length 164
00:18:36.408743 IP ubuntu-s-1vcpu-1gb-nyc1-01.ssh > 69.166.116.10.5276: Flags [P.], seq 10408:10444, ack 1, win 501, length 36
00:18:36.408774 IP ubuntu-s-1vcpu-1gb-nyc1-01.ssh > 69.166.116.10.5276: Flags [P.], seq 10444:10608, ack 1, win 501, length 164
00:18:36.408800 IP ubuntu-s-1vcpu-1gb-nyc1-01.ssh > 69.166.116.10.5276: Flags [P.], seq 10608:10644, ack 1, win 501, length 36
00:18:36.408831 IP ubuntu-s-1vcpu-1gb-nyc1-01.ssh > 69.166.116.10.5276: Flags [P.], seq 10644:10808, ack 1, win 501, length 164
00:18:36.408857 IP ubuntu-s-1vcpu-1gb-nyc1-01.ssh > 69.166.116.10.5276: Flags [P.], seq 10808:10844, ack 1, win 501, length 36
00:18:36.408888 IP ubuntu-s-1vcpu-1gb-nyc1-01.ssh > 69.166.116.10.5276: Flags [P.], seq 10844:11008, ack 1, win 501, length 164
00:18:36.408913 IP ubuntu-s-1vcpu-1gb-nyc1-01.ssh > 69.166.116.10.5276: Flags [P.], seq 11008:11044, ack 1, win 501, length 36
00:18:36.408943 IP ubuntu-s-1vcpu-1gb-nyc1-01.ssh > 69.166.116.10.5276: Flags [P.], seq 11044:11208, ack 1, win 501, length 164
00:18:36.408968 IP ubuntu-s-1vcpu-1gb-nyc1-01.ssh > 69.166.116.10.5276: Flags [P.], seq 11208:11244, ack 1, win 501, length 36
00:18:36.408999 IP ubuntu-s-1vcpu-1gb-nyc1-01.ssh > 69.166.116.10.5276: Flags [P.], seq 11244:11408, ack 1, win 501, length 164
00:18:36.409025 IP ubuntu-s-1vcpu-1gb-nyc1-01.ssh > 69.166.116.10.5276: Flags [P.], seq 11408:11444, ack 1, win 501, length 36
00:18:36.409056 IP ubuntu-s-1vcpu-1gb-nyc1-01.ssh > 69.166.116.10.5276: Flags [P.], seq 11444:11608, ack 1, win 501, length 164
00:18:36.409082 IP ubuntu-s-1vcpu-1gb-nyc1-01.ssh > 69.166.116.10.5276: Flags [P.], seq 11608:11644, ack 1, win 501, length 36
00:18:36.409113 IP ubuntu-s-1vcpu-1gb-nyc1-01.ssh > 69.166.116.10.5276: Flags [P.], seq 11644:11808, ack 1, win 501, length 164
00:18:36.409137 IP ubuntu-s-1vcpu-1gb-nyc1-01.ssh > 69.166.116.10.5276: Flags [P.], seq 11808:11844, ack 1, win 501, length 36
00:18:36.409167 IP ubuntu-s-1vcpu-1gb-nyc1-01.ssh > 69.166.116.10.5276: Flags [P.], seq 11844:12008, ack 1, win 501, length 164
00:18:36.409192 IP ubuntu-s-1vcpu-1gb-nyc1-01.ssh > 69.166.116.10.5276: Flags [P.], seq 12008:12044, ack 1, win 501, length 36
00:18:36.415503 IP 69.166.116.10.5276 > ubuntu-s-1vcpu-1gb-nyc1-01.ssh: Flags [.], ack 8224, win 513, length 0
00:18:36.415543 IP ubuntu-s-1vcpu-1gb-nyc1-01.ssh > 69.166.116.10.5276: Flags [P.], seq 12044:14444, ack 1, win 501, length 2400
00:18:36.415670 IP ubuntu-s-1vcpu-1gb-nyc1-01.ssh > 69.166.116.10.5276: Flags [P.], seq 14444:14592, ack 1, win 501, length 148
00:18:36.415705 IP ubuntu-s-1vcpu-1gb-nyc1-01.ssh > 69.166.116.10.5276: Flags [P.], seq 14592:14628, ack 1, win 501, length 36
00:18:36.415743 IP ubuntu-s-1vcpu-1gb-nyc1-01.ssh > 69.166.116.10.5276: Flags [P.], seq 14628:14792, ack 1, win 501, length 164
00:18:36.415768 IP ubuntu-s-1vcpu-1gb-nyc1-01.ssh > 69.166.116.10.5276: Flags [P.], seq 14792:14828, ack 1, win 501, length 36
00:18:36.415801 IP ubuntu-s-1vcpu-1gb-nyc1-01.ssh > 69.166.116.10.5276: Flags [P.], seq 14828:14992, ack 1, win 501, length 164
00:18:36.415827 IP ubuntu-s-1vcpu-1gb-nyc1-01.ssh > 69.166.116.10.5276: Flags [P.], seq 14992:15028, ack 1, win 501, length 36
00:18:36.415860 IP ubuntu-s-1vcpu-1gb-nyc1-01.ssh > 69.166.116.10.5276: Flags [P.], seq 15028:15192, ack 1, win 501, length 164
00:18:36.415884 IP ubuntu-s-1vcpu-1gb-nyc1-01.ssh > 69.166.116.10.5276: Flags [P.], seq 15192:15228, ack 1, win 501, length 36
00:18:36.415940 IP ubuntu-s-1vcpu-1gb-nyc1-01.ssh > 69.166.116.10.5276: Flags [P.], seq 15228:15392, ack 1, win 501, length 164
00:18:36.415969 IP ubuntu-s-1vcpu-1gb-nyc1-01.ssh > 69.166.116.10.5276: Flags [P.], seq 15392:15428, ack 1, win 501, length 36
00:18:36.416010 IP ubuntu-s-1vcpu-1gb-nyc1-01.ssh > 69.166.116.10.5276: Flags [P.], seq 15428:15592, ack 1, win 501, length 164
00:18:36.416042 IP ubuntu-s-1vcpu-1gb-nyc1-01.ssh > 69.166.116.10.5276: Flags [P.], seq 15592:15628, ack 1, win 501, length 36
00:18:36.416079 IP ubuntu-s-1vcpu-1gb-nyc1-01.ssh > 69.166.116.10.5276: Flags [P.], seq 15628:15792, ack 1, win 501, length 164
00:18:36.416106 IP ubuntu-s-1vcpu-1gb-nyc1-01.ssh > 69.166.116.10.5276: Flags [P.], seq 15792:15828, ack 1, win 501, length 36
00:18:36.416138 IP ubuntu-s-1vcpu-1gb-nyc1-01.ssh > 69.166.116.10.5276: Flags [P.], seq 15828:15992, ack 1, win 501, length 164
00:18:36.416165 IP ubuntu-s-1vcpu-1gb-nyc1-01.ssh > 69.166.116.10.5276: Flags [P.], seq 15992:16028, ack 1, win 501, length 36
00:18:36.416203 IP ubuntu-s-1vcpu-1gb-nyc1-01.ssh > 69.166.116.10.5276: Flags [P.], seq 16028:16192, ack 1, win 501, length 164
00:18:36.416227 IP ubuntu-s-1vcpu-1gb-nyc1-01.ssh > 69.166.116.10.5276: Flags [P.], seq 16192:16228, ack 1, win 501, length 36
00:18:36.416259 IP ubuntu-s-1vcpu-1gb-nyc1-01.ssh > 69.166.116.10.5276: Flags [P.], seq 16228:16392, ack 1, win 501, length 164
00:18:36.423212 IP 69.166.116.10.5276 > ubuntu-s-1vcpu-1gb-nyc1-01.ssh: Flags [.], ack 10644, win 513, length 0
00:18:36.423212 IP 69.166.116.10.5276 > ubuntu-s-1vcpu-1gb-nyc1-01.ssh: Flags [.], ack 12008, win 507, length 0
00:18:36.423247 IP ubuntu-s-1vcpu-1gb-nyc1-01.ssh > 69.166.116.10.5276: Flags [P.], seq 16392:18628, ack 1, win 501, length 2236
00:18:36.423386 IP ubuntu-s-1vcpu-1gb-nyc1-01.ssh > 69.166.116.10.5276: Flags [P.], seq 18628:18776, ack 1, win 501, length 148
00:18:36.423421 IP ubuntu-s-1vcpu-1gb-nyc1-01.ssh > 69.166.116.10.5276: Flags [P.], seq 18776:18812, ack 1, win 501, length 36
00:18:36.423456 IP ubuntu-s-1vcpu-1gb-nyc1-01.ssh > 69.166.116.10.5276: Flags [P.], seq 18812:18960, ack 1, win 501, length 148
00:18:36.423482 IP ubuntu-s-1vcpu-1gb-nyc1-01.ssh > 69.166.116.10.5276: Flags [P.], seq 18960:18996, ack 1, win 501, length 36
00:18:36.423516 IP ubuntu-s-1vcpu-1gb-nyc1-01.ssh > 69.166.116.10.5276: Flags [P.], seq 18996:19160, ack 1, win 501, length 164
00:18:36.423542 IP ubuntu-s-1vcpu-1gb-nyc1-01.ssh > 69.166.116.10.5276: Flags [P.], seq 19160:19196, ack 1, win 501, length 36
00:18:36.423575 IP ubuntu-s-1vcpu-1gb-nyc1-01.ssh > 69.166.116.10.5276: Flags [P.], seq 19196:19360, ack 1, win 501, length 164
00:18:36.423599 IP ubuntu-s-1vcpu-1gb-nyc1-01.ssh > 69.166.116.10.5276: Flags [P.], seq 19360:19396, ack 1, win 501, length 36
00:18:36.423632 IP ubuntu-s-1vcpu-1gb-nyc1-01.ssh > 69.166.116.10.5276: Flags [P.], seq 19396:19560, ack 1, win 501, length 164
00:18:36.423658 IP ubuntu-s-1vcpu-1gb-nyc1-01.ssh > 69.166.116.10.5276: Flags [P.], seq 19560:19596, ack 1, win 501, length 36
00:18:36.423689 IP ubuntu-s-1vcpu-1gb-nyc1-01.ssh > 69.166.116.10.5276: Flags [P.], seq 19596:19760, ack 1, win 501, length 164
00:18:36.423715 IP ubuntu-s-1vcpu-1gb-nyc1-01.ssh > 69.166.116.10.5276: Flags [P.], seq 19760:19796, ack 1, win 501, length 36
00:18:36.423747 IP ubuntu-s-1vcpu-1gb-nyc1-01.ssh > 69.166.116.10.5276: Flags [P.], seq 19796:19960, ack 1, win 501, length 164
00:18:36.423773 IP ubuntu-s-1vcpu-1gb-nyc1-01.ssh > 69.166.116.10.5276: Flags [P.], seq 19960:19996, ack 1, win 501, length 36
00:18:36.423805 IP ubuntu-s-1vcpu-1gb-nyc1-01.ssh > 69.166.116.10.5276: Flags [P.], seq 19996:20160, ack 1, win 501, length 164
00:18:36.423829 IP ubuntu-s-1vcpu-1gb-nyc1-01.ssh > 69.166.116.10.5276: Flags [P.], seq 20160:20196, ack 1, win 501, length 36
00:18:36.423860 IP ubuntu-s-1vcpu-1gb-nyc1-01.ssh > 69.166.116.10.5276: Flags [P.], seq 20196:20360, ack 1, win 501, length 164
00:18:36.423886 IP ubuntu-s-1vcpu-1gb-nyc1-01.ssh > 69.166.116.10.5276: Flags [P.], seq 20360:20396, ack 1, win 501, length 36
00:18:36.423931 IP ubuntu-s-1vcpu-1gb-nyc1-01.ssh > 69.166.116.10.5276: Flags [P.], seq 20396:20560, ack 1, win 501, length 164
00:18:36.423957 IP ubuntu-s-1vcpu-1gb-nyc1-01.ssh > 69.166.116.10.5276: Flags [P.], seq 20560:20596, ack 1, win 501, length 36
00:18:36.423989 IP ubuntu-s-1vcpu-1gb-nyc1-01.ssh > 69.166.116.10.5276: Flags [P.], seq 20596:20760, ack 1, win 501, length 164
00:18:36.424015 IP ubuntu-s-1vcpu-1gb-nyc1-01.ssh > 69.166.116.10.5276: Flags [P.], seq 20760:20796, ack 1, win 501, length 36
00:18:36.428497 IP 69.166.116.10.5276 > ubuntu-s-1vcpu-1gb-nyc1-01.ssh: Flags [.], ack 12044, win 507, length 0
00:18:36.428522 IP ubuntu-s-1vcpu-1gb-nyc1-01.ssh > 69.166.116.10.5276: Flags [.], seq 20796:22256, ack 1, win 501, length 1460
00:18:36.429966 IP 69.166.116.10.5276 > ubuntu-s-1vcpu-1gb-nyc1-01.ssh: Flags [.], ack 16192, win 513, length 0
00:18:36.429996 IP ubuntu-s-1vcpu-1gb-nyc1-01.ssh > 69.166.116.10.5276: Flags [P.], seq 22256:23980, ack 1, win 501, length 1724
00:18:36.430047 IP 69.166.116.10.5276 > ubuntu-s-1vcpu-1gb-nyc1-01.ssh: Flags [.], ack 16392, win 512, length 0
00:18:36.430109 IP ubuntu-s-1vcpu-1gb-nyc1-01.ssh > 69.166.116.10.5276: Flags [P.], seq 23980:24128, ack 1, win 501, length 148
00:18:36.430153 IP ubuntu-s-1vcpu-1gb-nyc1-01.ssh > 69.166.116.10.5276: Flags [P.], seq 24128:24164, ack 1, win 501, length 36
00:18:36.430207 IP ubuntu-s-1vcpu-1gb-nyc1-01.ssh > 69.166.116.10.5276: Flags [P.], seq 24164:24328, ack 1, win 501, length 164
00:18:36.430248 IP ubuntu-s-1vcpu-1gb-nyc1-01.ssh > 69.166.116.10.5276: Flags [P.], seq 24328:24364, ack 1, win 501, length 36
00:18:36.430297 IP ubuntu-s-1vcpu-1gb-nyc1-01.ssh > 69.166.116.10.5276: Flags [P.], seq 24364:24512, ack 1, win 501, length 148
00:18:36.430336 IP ubuntu-s-1vcpu-1gb-nyc1-01.ssh > 69.166.116.10.5276: Flags [P.], seq 24512:24548, ack 1, win 501, length 36
00:18:36.430384 IP ubuntu-s-1vcpu-1gb-nyc1-01.ssh > 69.166.116.10.5276: Flags [P.], seq 24548:24712, ack 1, win 501, length 164
00:18:36.430426 IP ubuntu-s-1vcpu-1gb-nyc1-01.ssh > 69.166.116.10.5276: Flags [P.], seq 24712:24748, ack 1, win 501, length 36
00:18:36.430472 IP ubuntu-s-1vcpu-1gb-nyc1-01.ssh > 69.166.116.10.5276: Flags [P.], seq 24748:24912, ack 1, win 501, length 164
00:18:36.430507 IP ubuntu-s-1vcpu-1gb-nyc1-01.ssh > 69.166.116.10.5276: Flags [P.], seq 24912:24948, ack 1, win 501, length 36
00:18:36.430556 IP ubuntu-s-1vcpu-1gb-nyc1-01.ssh > 69.166.116.10.5276: Flags [P.], seq 24948:25112, ack 1, win 501, length 164
00:18:36.430596 IP ubuntu-s-1vcpu-1gb-nyc1-01.ssh > 69.166.116.10.5276: Flags [P.], seq 25112:25148, ack 1, win 501, length 36
00:18:36.430661 IP ubuntu-s-1vcpu-1gb-nyc1-01.ssh > 69.166.116.10.5276: Flags [P.], seq 25148:25312, ack 1, win 501, length 164
00:18:36.430703 IP ubuntu-s-1vcpu-1gb-nyc1-01.ssh > 69.166.116.10.5276: Flags [P.], seq 25312:25348, ack 1, win 501, length 36
00:18:36.430750 IP ubuntu-s-1vcpu-1gb-nyc1-01.ssh > 69.166.116.10.5276: Flags [P.], seq 25348:25512, ack 1, win 501, length 164
00:18:36.430791 IP ubuntu-s-1vcpu-1gb-nyc1-01.ssh > 69.166.116.10.5276: Flags [P.], seq 25512:25548, ack 1, win 501, length 36
00:18:36.430841 IP ubuntu-s-1vcpu-1gb-nyc1-01.ssh > 69.166.116.10.5276: Flags [P.], seq 25548:25712, ack 1, win 501, length 164
00:18:36.430880 IP ubuntu-s-1vcpu-1gb-nyc1-01.ssh > 69.166.116.10.5276: Flags [P.], seq 25712:25748, ack 1, win 501, length 36
00:18:36.430925 IP ubuntu-s-1vcpu-1gb-nyc1-01.ssh > 69.166.116.10.5276: Flags [P.], seq 25748:25912, ack 1, win 501, length 164
00:18:36.430960 IP ubuntu-s-1vcpu-1gb-nyc1-01.ssh > 69.166.116.10.5276: Flags [P.], seq 25912:25948, ack 1, win 501, length 36
00:18:36.436788 IP 69.166.116.10.5276 > ubuntu-s-1vcpu-1gb-nyc1-01.ssh: Flags [.], ack 17852, win 513, length 0
00:18:36.436813 IP ubuntu-s-1vcpu-1gb-nyc1-01.ssh > 69.166.116.10.5276: Flags [.], seq 25948:27408, ack 1, win 501, length 1460
00:18:36.438265 IP 69.166.116.10.5276 > ubuntu-s-1vcpu-1gb-nyc1-01.ssh: Flags [.], ack 20760, win 513, length 0
00:18:36.438288 IP ubuntu-s-1vcpu-1gb-nyc1-01.ssh > 69.166.116.10.5276: Flags [P.], seq 27408:28932, ack 1, win 501, length 1524
00:18:36.438348 IP ubuntu-s-1vcpu-1gb-nyc1-01.ssh > 69.166.116.10.5276: Flags [P.], seq 28932:29080, ack 1, win 501, length 148
00:18:36.438377 IP ubuntu-s-1vcpu-1gb-nyc1-01.ssh > 69.166.116.10.5276: Flags [P.], seq 29080:29116, ack 1, win 501, length 36
00:18:36.438409 IP ubuntu-s-1vcpu-1gb-nyc1-01.ssh > 69.166.116.10.5276: Flags [P.], seq 29116:29280, ack 1, win 501, length 164
00:18:36.438435 IP ubuntu-s-1vcpu-1gb-nyc1-01.ssh > 69.166.116.10.5276: Flags [P.], seq 29280:29316, ack 1, win 501, length 36
00:18:36.438469 IP ubuntu-s-1vcpu-1gb-nyc1-01.ssh > 69.166.116.10.5276: Flags [P.], seq 29316:29480, ack 1, win 501, length 164
00:18:36.438492 IP ubuntu-s-1vcpu-1gb-nyc1-01.ssh > 69.166.116.10.5276: Flags [P.], seq 29480:29516, ack 1, win 501, length 36
00:18:36.438523 IP ubuntu-s-1vcpu-1gb-nyc1-01.ssh > 69.166.116.10.5276: Flags [P.], seq 29516:29680, ack 1, win 501, length 164
00:18:36.438548 IP ubuntu-s-1vcpu-1gb-nyc1-01.ssh > 69.166.116.10.5276: Flags [P.], seq 29680:29716, ack 1, win 501, length 36
00:18:36.438579 IP ubuntu-s-1vcpu-1gb-nyc1-01.ssh > 69.166.116.10.5276: Flags [P.], seq 29716:29880, ack 1, win 501, length 164
00:18:36.438602 IP ubuntu-s-1vcpu-1gb-nyc1-01.ssh > 69.166.116.10.5276: Flags [P.], seq 29880:29916, ack 1, win 501, length 36
00:18:36.438633 IP ubuntu-s-1vcpu-1gb-nyc1-01.ssh > 69.166.116.10.5276: Flags [P.], seq 29916:30080, ack 1, win 501, length 164
00:18:36.438670 IP ubuntu-s-1vcpu-1gb-nyc1-01.ssh > 69.166.116.10.5276: Flags [P.], seq 30080:30116, ack 1, win 501, length 36
00:18:36.438701 IP ubuntu-s-1vcpu-1gb-nyc1-01.ssh > 69.166.116.10.5276: Flags [P.], seq 30116:30280, ack 1, win 501, length 164
00:18:36.438734 IP ubuntu-s-1vcpu-1gb-nyc1-01.ssh > 69.166.116.10.5276: Flags [P.], seq 30280:30316, ack 1, win 501, length 36
00:18:36.438777 IP ubuntu-s-1vcpu-1gb-nyc1-01.ssh > 69.166.116.10.5276: Flags [P.], seq 30316:30480, ack 1, win 501, length 164
00:18:36.438812 IP ubuntu-s-1vcpu-1gb-nyc1-01.ssh > 69.166.116.10.5276: Flags [P.], seq 30480:30516, ack 1, win 501, length 36
00:18:36.438855 IP ubuntu-s-1vcpu-1gb-nyc1-01.ssh > 69.166.116.10.5276: Flags [P.], seq 30516:30680, ack 1, win 501, length 164
00:18:36.438898 IP ubuntu-s-1vcpu-1gb-nyc1-01.ssh > 69.166.116.10.5276: Flags [P.], seq 30680:30716, ack 1, win 501, length 36
00:18:36.438934 IP ubuntu-s-1vcpu-1gb-nyc1-01.ssh > 69.166.116.10.5276: Flags [P.], seq 30716:30880, ack 1, win 501, length 164
00:18:36.438957 IP ubuntu-s-1vcpu-1gb-nyc1-01.ssh > 69.166.116.10.5276: Flags [P.], seq 30880:30916, ack 1, win 501, length 36
00:18:36.438988 IP ubuntu-s-1vcpu-1gb-nyc1-01.ssh > 69.166.116.10.5276: Flags [P.], seq 30916:31080, ack 1, win 501, length 164
00:18:36.439013 IP ubuntu-s-1vcpu-1gb-nyc1-01.ssh > 69.166.116.10.5276: Flags [P.], seq 31080:31116, ack 1, win 501, length 36
00:18:36.441534 IP 69.166.116.10.5276 > ubuntu-s-1vcpu-1gb-nyc1-01.ssh: Flags [.], ack 22256, win 513, length 0
00:18:36.441551 IP ubuntu-s-1vcpu-1gb-nyc1-01.ssh > 69.166.116.10.5276: Flags [P.], seq 31116:33716, ack 1, win 501, length 2600
00:18:36.444219 IP 69.166.116.10.5276 > ubuntu-s-1vcpu-1gb-nyc1-01.ssh: Flags [.], ack 25912, win 513, length 0
00:18:36.444244 IP ubuntu-s-1vcpu-1gb-nyc1-01.ssh > 69.166.116.10.5276: Flags [P.], seq 33716:34100, ack 1, win 501, length 384
00:18:36.444319 IP ubuntu-s-1vcpu-1gb-nyc1-01.ssh > 69.166.116.10.5276: Flags [P.], seq 34100:34248, ack 1, win 501, length 148
00:18:36.444352 IP ubuntu-s-1vcpu-1gb-nyc1-01.ssh > 69.166.116.10.5276: Flags [P.], seq 34248:34284, ack 1, win 501, length 36
00:18:36.444387 IP ubuntu-s-1vcpu-1gb-nyc1-01.ssh > 69.166.116.10.5276: Flags [P.], seq 34284:34448, ack 1, win 501, length 164
00:18:36.444413 IP ubuntu-s-1vcpu-1gb-nyc1-01.ssh > 69.166.116.10.5276: Flags [P.], seq 34448:34484, ack 1, win 501, length 36
00:18:36.444444 IP ubuntu-s-1vcpu-1gb-nyc1-01.ssh > 69.166.116.10.5276: Flags [P.], seq 34484:34648, ack 1, win 501, length 164
00:18:36.444468 IP ubuntu-s-1vcpu-1gb-nyc1-01.ssh > 69.166.116.10.5276: Flags [P.], seq 34648:34684, ack 1, win 501, length 36
00:18:36.444499 IP ubuntu-s-1vcpu-1gb-nyc1-01.ssh > 69.166.116.10.5276: Flags [P.], seq 34684:34848, ack 1, win 501, length 164
00:18:36.444524 IP ubuntu-s-1vcpu-1gb-nyc1-01.ssh > 69.166.116.10.5276: Flags [P.], seq 34848:34884, ack 1, win 501, length 36
00:18:36.444555 IP ubuntu-s-1vcpu-1gb-nyc1-01.ssh > 69.166.116.10.5276: Flags [P.], seq 34884:35048, ack 1, win 501, length 164
00:18:36.444580 IP ubuntu-s-1vcpu-1gb-nyc1-01.ssh > 69.166.116.10.5276: Flags [P.], seq 35048:35084, ack 1, win 501, length 36
00:18:36.444611 IP ubuntu-s-1vcpu-1gb-nyc1-01.ssh > 69.166.116.10.5276: Flags [P.], seq 35084:35248, ack 1, win 501, length 164
00:18:36.444636 IP ubuntu-s-1vcpu-1gb-nyc1-01.ssh > 69.166.116.10.5276: Flags [P.], seq 35248:35284, ack 1, win 501, length 36
00:18:36.444667 IP ubuntu-s-1vcpu-1gb-nyc1-01.ssh > 69.166.116.10.5276: Flags [P.], seq 35284:35448, ack 1, win 501, length 164
00:18:36.444692 IP ubuntu-s-1vcpu-1gb-nyc1-01.ssh > 69.166.116.10.5276: Flags [P.], seq 35448:35484, ack 1, win 501, length 36
00:18:36.444723 IP ubuntu-s-1vcpu-1gb-nyc1-01.ssh > 69.166.116.10.5276: Flags [P.], seq 35484:35648, ack 1, win 501, length 164
00:18:36.444747 IP ubuntu-s-1vcpu-1gb-nyc1-01.ssh > 69.166.116.10.5276: Flags [P.], seq 35648:35684, ack 1, win 501, length 36
00:18:36.444777 IP ubuntu-s-1vcpu-1gb-nyc1-01.ssh > 69.166.116.10.5276: Flags [P.], seq 35684:35848, ack 1, win 501, length 164
00:18:36.444802 IP ubuntu-s-1vcpu-1gb-nyc1-01.ssh > 69.166.116.10.5276: Flags [P.], seq 35848:35884, ack 1, win 501, length 36
00:18:36.444833 IP ubuntu-s-1vcpu-1gb-nyc1-01.ssh > 69.166.116.10.5276: Flags [P.], seq 35884:36048, ack 1, win 501, length 164
00:18:36.444863 IP ubuntu-s-1vcpu-1gb-nyc1-01.ssh > 69.166.116.10.5276: Flags [P.], seq 36048:36084, ack 1, win 501, length 36
00:18:36.449772 IP 69.166.116.10.5276 > ubuntu-s-1vcpu-1gb-nyc1-01.ssh: Flags [.], ack 25948, win 513, length 0
00:18:36.449811 IP ubuntu-s-1vcpu-1gb-nyc1-01.ssh > 69.166.116.10.5276: Flags [.], seq 36084:37544, ack 1, win 501, length 1460
00:18:36.451244 IP 69.166.116.10.5276 > ubuntu-s-1vcpu-1gb-nyc1-01.ssh: Flags [.], ack 28868, win 513, length 0
00:18:36.451255 IP ubuntu-s-1vcpu-1gb-nyc1-01.ssh > 69.166.116.10.5276: Flags [P.], seq 37544:38868, ack 1, win 501, length 1324
00:18:36.451300 IP ubuntu-s-1vcpu-1gb-nyc1-01.ssh > 69.166.116.10.5276: Flags [P.], seq 38868:39016, ack 1, win 501, length 148
00:18:36.452403 IP 69.166.116.10.5276 > ubuntu-s-1vcpu-1gb-nyc1-01.ssh: Flags [.], ack 29716, win 509, length 0
00:18:36.452413 IP ubuntu-s-1vcpu-1gb-nyc1-01.ssh > 69.166.116.10.5276: Flags [P.], seq 39016:39452, ack 1, win 501, length 436
00:18:36.452450 IP ubuntu-s-1vcpu-1gb-nyc1-01.ssh > 69.166.116.10.5276: Flags [P.], seq 39452:39600, ack 1, win 501, length 148
00:18:36.452476 IP ubuntu-s-1vcpu-1gb-nyc1-01.ssh > 69.166.116.10.5276: Flags [P.], seq 39600:39636, ack 1, win 501, length 36
00:18:36.452507 IP ubuntu-s-1vcpu-1gb-nyc1-01.ssh > 69.166.116.10.5276: Flags [P.], seq 39636:39800, ack 1, win 501, length 164
00:18:36.452531 IP ubuntu-s-1vcpu-1gb-nyc1-01.ssh > 69.166.116.10.5276: Flags [P.], seq 39800:39836, ack 1, win 501, length 36
00:18:36.452561 IP ubuntu-s-1vcpu-1gb-nyc1-01.ssh > 69.166.116.10.5276: Flags [P.], seq 39836:40000, ack 1, win 501, length 164
00:18:36.452585 IP ubuntu-s-1vcpu-1gb-nyc1-01.ssh > 69.166.116.10.5276: Flags [P.], seq 40000:40036, ack 1, win 501, length 36
00:18:36.452610 IP ubuntu-s-1vcpu-1gb-nyc1-01.ssh > 69.166.116.10.5276: Flags [P.], seq 40036:40200, ack 1, win 501, length 164
00:18:36.452637 IP ubuntu-s-1vcpu-1gb-nyc1-01.ssh > 69.166.116.10.5276: Flags [P.], seq 40200:40236, ack 1, win 501, length 36
00:18:36.458118 IP 69.166.116.10.5276 > ubuntu-s-1vcpu-1gb-nyc1-01.ssh: Flags [.], ack 31080, win 513, length 0
00:18:36.458118 IP 69.166.116.10.5276 > ubuntu-s-1vcpu-1gb-nyc1-01.ssh: Flags [.], ack 33716, win 513, length 0
00:18:36.458159 IP ubuntu-s-1vcpu-1gb-nyc1-01.ssh > 69.166.116.10.5276: Flags [P.], seq 40236:41084, ack 1, win 501, length 848
00:18:36.458282 IP ubuntu-s-1vcpu-1gb-nyc1-01.ssh > 69.166.116.10.5276: Flags [P.], seq 41084:41232, ack 1, win 501, length 148
00:18:36.458332 IP ubuntu-s-1vcpu-1gb-nyc1-01.ssh > 69.166.116.10.5276: Flags [P.], seq 41232:41268, ack 1, win 501, length 36
00:18:36.458370 IP ubuntu-s-1vcpu-1gb-nyc1-01.ssh > 69.166.116.10.5276: Flags [P.], seq 41268:41416, ack 1, win 501, length 148
00:18:36.458397 IP ubuntu-s-1vcpu-1gb-nyc1-01.ssh > 69.166.116.10.5276: Flags [P.], seq 41416:41452, ack 1, win 501, length 36
00:18:36.458441 IP ubuntu-s-1vcpu-1gb-nyc1-01.ssh > 69.166.116.10.5276: Flags [P.], seq 41452:41744, ack 1, win 501, length 292
00:18:36.458498 IP ubuntu-s-1vcpu-1gb-nyc1-01.ssh > 69.166.116.10.5276: Flags [P.], seq 41744:42300, ack 1, win 501, length 556
00:18:36.458538 IP ubuntu-s-1vcpu-1gb-nyc1-01.ssh > 69.166.116.10.5276: Flags [P.], seq 42300:42464, ack 1, win 501, length 164
00:18:36.458578 IP ubuntu-s-1vcpu-1gb-nyc1-01.ssh > 69.166.116.10.5276: Flags [P.], seq 42464:42628, ack 1, win 501, length 164
00:18:36.458615 IP ubuntu-s-1vcpu-1gb-nyc1-01.ssh > 69.166.116.10.5276: Flags [P.], seq 42628:42792, ack 1, win 501, length 164
00:18:36.458626 IP 69.166.116.10.5276 > ubuntu-s-1vcpu-1gb-nyc1-01.ssh: Flags [.], ack 34100, win 511, length 0
00:18:36.458680 IP ubuntu-s-1vcpu-1gb-nyc1-01.ssh > 69.166.116.10.5276: Flags [P.], seq 42792:43068, ack 1, win 501, length 276
00:18:36.458719 IP ubuntu-s-1vcpu-1gb-nyc1-01.ssh > 69.166.116.10.5276: Flags [P.], seq 43068:43232, ack 1, win 501, length 164
00:18:36.458756 IP ubuntu-s-1vcpu-1gb-nyc1-01.ssh > 69.166.116.10.5276: Flags [P.], seq 43232:43396, ack 1, win 501, length 164
00:18:36.458792 IP ubuntu-s-1vcpu-1gb-nyc1-01.ssh > 69.166.116.10.5276: Flags [P.], seq 43396:43560, ack 1, win 501, length 164
00:18:36.458831 IP ubuntu-s-1vcpu-1gb-nyc1-01.ssh > 69.166.116.10.5276: Flags [P.], seq 43560:43724, ack 1, win 501, length 164
00:18:36.458869 IP ubuntu-s-1vcpu-1gb-nyc1-01.ssh > 69.166.116.10.5276: Flags [P.], seq 43724:43888, ack 1, win 501, length 164
00:18:36.458906 IP ubuntu-s-1vcpu-1gb-nyc1-01.ssh > 69.166.116.10.5276: Flags [P.], seq 43888:44052, ack 1, win 501, length 164
00:18:36.458943 IP ubuntu-s-1vcpu-1gb-nyc1-01.ssh > 69.166.116.10.5276: Flags [P.], seq 44052:44216, ack 1, win 501, length 164
00:18:36.459622 IP 69.166.116.10.5276 > ubuntu-s-1vcpu-1gb-nyc1-01.ssh: Flags [.], ack 35484, win 513, length 0
00:18:36.459631 IP ubuntu-s-1vcpu-1gb-nyc1-01.ssh > 69.166.116.10.5276: Flags [P.], seq 44216:44380, ack 1, win 501, length 164
00:18:36.459684 IP ubuntu-s-1vcpu-1gb-nyc1-01.ssh > 69.166.116.10.5276: Flags [P.], seq 44380:44656, ack 1, win 501, length 276
00:18:36.459721 IP ubuntu-s-1vcpu-1gb-nyc1-01.ssh > 69.166.116.10.5276: Flags [P.], seq 44656:44820, ack 1, win 501, length 164
00:18:36.459758 IP ubuntu-s-1vcpu-1gb-nyc1-01.ssh > 69.166.116.10.5276: Flags [P.], seq 44820:44984, ack 1, win 501, length 164
00:18:36.459794 IP ubuntu-s-1vcpu-1gb-nyc1-01.ssh > 69.166.116.10.5276: Flags [P.], seq 44984:45148, ack 1, win 501, length 164
00:18:36.459830 IP ubuntu-s-1vcpu-1gb-nyc1-01.ssh > 69.166.116.10.5276: Flags [P.], seq 45148:45312, ack 1, win 501, length 164
00:18:36.459866 IP ubuntu-s-1vcpu-1gb-nyc1-01.ssh > 69.166.116.10.5276: Flags [P.], seq 45312:45476, ack 1, win 501, length 164
00:18:36.459902 IP ubuntu-s-1vcpu-1gb-nyc1-01.ssh > 69.166.116.10.5276: Flags [P.], seq 45476:45640, ack 1, win 501, length 164
00:18:36.459947 IP ubuntu-s-1vcpu-1gb-nyc1-01.ssh > 69.166.116.10.5276: Flags [P.], seq 45640:45804, ack 1, win 501, length 164
00:18:36.459984 IP ubuntu-s-1vcpu-1gb-nyc1-01.ssh > 69.166.116.10.5276: Flags [P.], seq 45804:45968, ack 1, win 501, length 164
00:18:36.460019 IP ubuntu-s-1vcpu-1gb-nyc1-01.ssh > 69.166.116.10.5276: Flags [P.], seq 45968:46132, ack 1, win 501, length 164
00:18:36.460066 IP ubuntu-s-1vcpu-1gb-nyc1-01.ssh > 69.166.116.10.5276: Flags [P.], seq 46132:46296, ack 1, win 501, length 164
00:18:36.460102 IP ubuntu-s-1vcpu-1gb-nyc1-01.ssh > 69.166.116.10.5276: Flags [P.], seq 46296:46460, ack 1, win 501, length 164
00:18:36.460138 IP ubuntu-s-1vcpu-1gb-nyc1-01.ssh > 69.166.116.10.5276: Flags [P.], seq 46460:46624, ack 1, win 501, length 164
00:18:36.460408 IP 69.166.116.10.5276 > ubuntu-s-1vcpu-1gb-nyc1-01.ssh: Flags [.], ack 36084, win 510, length 0
00:18:36.460418 IP ubuntu-s-1vcpu-1gb-nyc1-01.ssh > 69.166.116.10.5276: Flags [P.], seq 46624:46788, ack 1, win 501, length 164
00:18:36.460486 IP ubuntu-s-1vcpu-1gb-nyc1-01.ssh > 69.166.116.10.5276: Flags [P.], seq 46788:47064, ack 1, win 501, length 276
00:18:36.460540 IP ubuntu-s-1vcpu-1gb-nyc1-01.ssh > 69.166.116.10.5276: Flags [P.], seq 47064:47228, ack 1, win 501, length 164
00:18:36.460600 IP ubuntu-s-1vcpu-1gb-nyc1-01.ssh > 69.166.116.10.5276: Flags [P.], seq 47228:47392, ack 1, win 501, length 164
00:18:36.460651 IP ubuntu-s-1vcpu-1gb-nyc1-01.ssh > 69.166.116.10.5276: Flags [P.], seq 47392:47556, ack 1, win 501, length 164
00:18:36.460687 IP ubuntu-s-1vcpu-1gb-nyc1-01.ssh > 69.166.116.10.5276: Flags [P.], seq 47556:47720, ack 1, win 501, length 164
00:18:36.464458 IP 69.166.116.10.5276 > ubuntu-s-1vcpu-1gb-nyc1-01.ssh: Flags [.], ack 39016, win 513, length 0
00:18:36.464476 IP ubuntu-s-1vcpu-1gb-nyc1-01.ssh > 69.166.116.10.5276: Flags [P.], seq 47720:47884, ack 1, win 501, length 164
00:18:36.464566 IP ubuntu-s-1vcpu-1gb-nyc1-01.ssh > 69.166.116.10.5276: Flags [P.], seq 47884:48160, ack 1, win 501, length 276
00:18:36.464610 IP ubuntu-s-1vcpu-1gb-nyc1-01.ssh > 69.166.116.10.5276: Flags [P.], seq 48160:48324, ack 1, win 501, length 164
00:18:36.465056 IP 69.166.116.10.5276 > ubuntu-s-1vcpu-1gb-nyc1-01.ssh: Flags [.], ack 39452, win 511, length 0
00:18:36.465063 IP ubuntu-s-1vcpu-1gb-nyc1-01.ssh > 69.166.116.10.5276: Flags [P.], seq 48324:48488, ack 1, win 501, length 164
00:18:36.465827 IP 69.166.116.10.5276 > ubuntu-s-1vcpu-1gb-nyc1-01.ssh: Flags [.], ack 40200, win 508, length 0
00:18:36.465834 IP ubuntu-s-1vcpu-1gb-nyc1-01.ssh > 69.166.116.10.5276: Flags [P.], seq 48488:48764, ack 1, win 501, length 276
00:18:36.465886 IP ubuntu-s-1vcpu-1gb-nyc1-01.ssh > 69.166.116.10.5276: Flags [P.], seq 48764:49040, ack 1, win 501, length 276
00:18:36.465924 IP ubuntu-s-1vcpu-1gb-nyc1-01.ssh > 69.166.116.10.5276: Flags [P.], seq 49040:49204, ack 1, win 501, length 164
00:18:36.465961 IP ubuntu-s-1vcpu-1gb-nyc1-01.ssh > 69.166.116.10.5276: Flags [P.], seq 49204:49368, ack 1, win 501, length 164
00:18:36.465999 IP ubuntu-s-1vcpu-1gb-nyc1-01.ssh > 69.166.116.10.5276: Flags [P.], seq 49368:49532, ack 1, win 501, length 164
00:18:36.466035 IP ubuntu-s-1vcpu-1gb-nyc1-01.ssh > 69.166.116.10.5276: Flags [P.], seq 49532:49696, ack 1, win 501, length 164
00:18:36.466072 IP ubuntu-s-1vcpu-1gb-nyc1-01.ssh > 69.166.116.10.5276: Flags [P.], seq 49696:49860, ack 1, win 501, length 164
00:18:36.470843 IP 69.166.116.10.5276 > ubuntu-s-1vcpu-1gb-nyc1-01.ssh: Flags [.], ack 40236, win 508, length 0
00:18:36.470858 IP ubuntu-s-1vcpu-1gb-nyc1-01.ssh > 69.166.116.10.5276: Flags [P.], seq 49860:50024, ack 1, win 501, length 164
00:18:36.472522 IP 69.166.116.10.5276 > ubuntu-s-1vcpu-1gb-nyc1-01.ssh: Flags [.], ack 42464, win 513, length 0
00:18:36.472532 IP ubuntu-s-1vcpu-1gb-nyc1-01.ssh > 69.166.116.10.5276: Flags [P.], seq 50024:50300, ack 1, win 501, length 276
00:18:36.472601 IP ubuntu-s-1vcpu-1gb-nyc1-01.ssh > 69.166.116.10.5276: Flags [P.], seq 50300:50576, ack 1, win 501, length 276
00:18:36.472642 IP ubuntu-s-1vcpu-1gb-nyc1-01.ssh > 69.166.116.10.5276: Flags [P.], seq 50576:50740, ack 1, win 501, length 164
00:18:36.472679 IP ubuntu-s-1vcpu-1gb-nyc1-01.ssh > 69.166.116.10.5276: Flags [P.], seq 50740:50904, ack 1, win 501, length 164
00:18:36.472715 IP ubuntu-s-1vcpu-1gb-nyc1-01.ssh > 69.166.116.10.5276: Flags [P.], seq 50904:51068, ack 1, win 501, length 164
00:18:36.472752 IP ubuntu-s-1vcpu-1gb-nyc1-01.ssh > 69.166.116.10.5276: Flags [P.], seq 51068:51232, ack 1, win 501, length 164
00:18:36.472789 IP ubuntu-s-1vcpu-1gb-nyc1-01.ssh > 69.166.116.10.5276: Flags [P.], seq 51232:51396, ack 1, win 501, length 164
00:18:36.472826 IP ubuntu-s-1vcpu-1gb-nyc1-01.ssh > 69.166.116.10.5276: Flags [P.], seq 51396:51560, ack 1, win 501, length 164
00:18:36.476297 IP 69.166.116.10.5276 > ubuntu-s-1vcpu-1gb-nyc1-01.ssh: Flags [.], ack 43068, win 510, length 0
00:18:36.476307 IP ubuntu-s-1vcpu-1gb-nyc1-01.ssh > 69.166.116.10.5276: Flags [P.], seq 51560:51724, ack 1, win 501, length 164
00:18:36.476370 IP ubuntu-s-1vcpu-1gb-nyc1-01.ssh > 69.166.116.10.5276: Flags [P.], seq 51724:52000, ack 1, win 501, length 276
00:18:36.476411 IP ubuntu-s-1vcpu-1gb-nyc1-01.ssh > 69.166.116.10.5276: Flags [P.], seq 52000:52164, ack 1, win 501, length 164
00:18:36.477266 IP 69.166.116.10.5276 > ubuntu-s-1vcpu-1gb-nyc1-01.ssh: Flags [.], ack 44984, win 513, length 0
00:18:36.477275 IP ubuntu-s-1vcpu-1gb-nyc1-01.ssh > 69.166.116.10.5276: Flags [P.], seq 52164:52328, ack 1, win 501, length 164
00:18:36.477337 IP 69.166.116.10.5276 > ubuntu-s-1vcpu-1gb-nyc1-01.ssh: Flags [.], ack 47720, win 513, length 0
00:18:36.477337 IP 69.166.116.10.5276 > ubuntu-s-1vcpu-1gb-nyc1-01.ssh: Flags [P.], seq 1:37, ack 47720, win 513, length 36
00:18:36.477337 IP 69.166.116.10.5276 > ubuntu-s-1vcpu-1gb-nyc1-01.ssh: Flags [.], ack 48324, win 510, length 0
00:18:36.477337 IP 69.166.116.10.5276 > ubuntu-s-1vcpu-1gb-nyc1-01.ssh: Flags [.], ack 48488, win 510, length 0
00:18:36.477362 IP ubuntu-s-1vcpu-1gb-nyc1-01.ssh > 69.166.116.10.5276: Flags [.], ack 37, win 501, length 0
00:18:36.477370 IP ubuntu-s-1vcpu-1gb-nyc1-01.ssh > 69.166.116.10.5276: Flags [P.], seq 52328:52604, ack 37, win 501, length 276
00:18:36.477443 IP ubuntu-s-1vcpu-1gb-nyc1-01.ssh > 69.166.116.10.5276: Flags [P.], seq 52604:53344, ack 37, win 501, length 740
00:18:36.477481 IP ubuntu-s-1vcpu-1gb-nyc1-01.ssh > 69.166.116.10.5276: Flags [P.], seq 53344:53508, ack 37, win 501, length 164
00:18:36.477518 IP ubuntu-s-1vcpu-1gb-nyc1-01.ssh > 69.166.116.10.5276: Flags [P.], seq 53508:53672, ack 37, win 501, length 164
00:18:36.477554 IP ubuntu-s-1vcpu-1gb-nyc1-01.ssh > 69.166.116.10.5276: Flags [P.], seq 53672:53836, ack 37, win 501, length 164
00:18:36.477593 IP ubuntu-s-1vcpu-1gb-nyc1-01.ssh > 69.166.116.10.5276: Flags [P.], seq 53836:54000, ack 37, win 501, length 164
00:18:36.477657 IP ubuntu-s-1vcpu-1gb-nyc1-01.ssh > 69.166.116.10.5276: Flags [P.], seq 54000:54164, ack 37, win 501, length 164
00:18:36.477708 IP ubuntu-s-1vcpu-1gb-nyc1-01.ssh > 69.166.116.10.5276: Flags [P.], seq 54164:54328, ack 37, win 501, length 164
00:18:36.477746 IP ubuntu-s-1vcpu-1gb-nyc1-01.ssh > 69.166.116.10.5276: Flags [P.], seq 54328:54492, ack 37, win 501, length 164
00:18:36.477783 IP ubuntu-s-1vcpu-1gb-nyc1-01.ssh > 69.166.116.10.5276: Flags [P.], seq 54492:54656, ack 37, win 501, length 164
00:18:36.477822 IP ubuntu-s-1vcpu-1gb-nyc1-01.ssh > 69.166.116.10.5276: Flags [P.], seq 54656:54820, ack 37, win 501, length 164
00:18:36.477858 IP ubuntu-s-1vcpu-1gb-nyc1-01.ssh > 69.166.116.10.5276: Flags [P.], seq 54820:54984, ack 37, win 501, length 164
00:18:36.477895 IP ubuntu-s-1vcpu-1gb-nyc1-01.ssh > 69.166.116.10.5276: Flags [P.], seq 54984:55148, ack 37, win 501, length 164
00:18:36.477931 IP ubuntu-s-1vcpu-1gb-nyc1-01.ssh > 69.166.116.10.5276: Flags [P.], seq 55148:55312, ack 37, win 501, length 164
00:18:36.477967 IP ubuntu-s-1vcpu-1gb-nyc1-01.ssh > 69.166.116.10.5276: Flags [P.], seq 55312:55476, ack 37, win 501, length 164
00:18:36.478003 IP ubuntu-s-1vcpu-1gb-nyc1-01.ssh > 69.166.116.10.5276: Flags [P.], seq 55476:55640, ack 37, win 501, length 164
00:18:36.478040 IP ubuntu-s-1vcpu-1gb-nyc1-01.ssh > 69.166.116.10.5276: Flags [P.], seq 55640:55804, ack 37, win 501, length 164
00:18:36.478076 IP ubuntu-s-1vcpu-1gb-nyc1-01.ssh > 69.166.116.10.5276: Flags [P.], seq 55804:55968, ack 37, win 501, length 164
00:18:36.478112 IP ubuntu-s-1vcpu-1gb-nyc1-01.ssh > 69.166.116.10.5276: Flags [P.], seq 55968:56132, ack 37, win 501, length 164
00:18:36.478159 IP ubuntu-s-1vcpu-1gb-nyc1-01.ssh > 69.166.116.10.5276: Flags [P.], seq 56132:56296, ack 37, win 501, length 164
00:18:36.478192 IP ubuntu-s-1vcpu-1gb-nyc1-01.ssh > 69.166.116.10.5276: Flags [P.], seq 56296:56460, ack 37, win 501, length 164
00:18:36.478225 IP ubuntu-s-1vcpu-1gb-nyc1-01.ssh > 69.166.116.10.5276: Flags [P.], seq 56460:56624, ack 37, win 501, length 164
00:18:36.478258 IP ubuntu-s-1vcpu-1gb-nyc1-01.ssh > 69.166.116.10.5276: Flags [P.], seq 56624:56788, ack 37, win 501, length 164
00:18:36.478292 IP ubuntu-s-1vcpu-1gb-nyc1-01.ssh > 69.166.116.10.5276: Flags [P.], seq 56788:56952, ack 37, win 501, length 164
00:18:36.478326 IP ubuntu-s-1vcpu-1gb-nyc1-01.ssh > 69.166.116.10.5276: Flags [P.], seq 56952:57116, ack 37, win 501, length 164
00:18:36.478358 IP ubuntu-s-1vcpu-1gb-nyc1-01.ssh > 69.166.116.10.5276: Flags [P.], seq 57116:57280, ack 37, win 501, length 164
00:18:36.478391 IP ubuntu-s-1vcpu-1gb-nyc1-01.ssh > 69.166.116.10.5276: Flags [P.], seq 57280:57444, ack 37, win 501, length 164
00:18:36.478446 IP ubuntu-s-1vcpu-1gb-nyc1-01.ssh > 69.166.116.10.5276: Flags [P.], seq 57444:57608, ack 37, win 501, length 164
00:18:36.478492 IP ubuntu-s-1vcpu-1gb-nyc1-01.ssh > 69.166.116.10.5276: Flags [P.], seq 57608:57772, ack 37, win 501, length 164
00:18:36.478524 IP ubuntu-s-1vcpu-1gb-nyc1-01.ssh > 69.166.116.10.5276: Flags [P.], seq 57772:57936, ack 37, win 501, length 164
