root@ubuntu-s-1vcpu-1gb-nyc1-01:~# tcpdump -i eth0 port 22
tcpdump: verbose output suppressed, use -v or -vv for full protocol decode
listening on eth0, link-type EN10MB (Ethernet), capture size 262144 bytes
00:19:00.793573 IP ubuntu-s-1vcpu-1gb-nyc1-01.ssh > 69.166.116.10.5276: Flags [P.], seq 4126503697:4126503805, ack 2999390586, win 501, length 108
00:19:00.793618 IP ubuntu-s-1vcpu-1gb-nyc1-01.ssh > 69.166.116.10.5276: Flags [P.], seq 108:144, ack 1, win 501, length 36
00:19:00.793650 IP ubuntu-s-1vcpu-1gb-nyc1-01.ssh > 69.166.116.10.5276: Flags [P.], seq 144:252, ack 1, win 501, length 108
00:19:00.793676 IP ubuntu-s-1vcpu-1gb-nyc1-01.ssh > 69.166.116.10.5276: Flags [P.], seq 252:288, ack 1, win 501, length 36
00:19:00.796638 IP ubuntu-s-1vcpu-1gb-nyc1-01.ssh > 69.166.116.10.5276: Flags [P.], seq 288:468, ack 1, win 501, length 180
00:19:00.796677 IP ubuntu-s-1vcpu-1gb-nyc1-01.ssh > 69.166.116.10.5276: Flags [P.], seq 468:504, ack 1, win 501, length 36
00:19:00.796716 IP ubuntu-s-1vcpu-1gb-nyc1-01.ssh > 69.166.116.10.5276: Flags [P.], seq 504:660, ack 1, win 501, length 156
00:19:00.796742 IP ubuntu-s-1vcpu-1gb-nyc1-01.ssh > 69.166.116.10.5276: Flags [P.], seq 660:696, ack 1, win 501, length 36
00:19:00.796774 IP ubuntu-s-1vcpu-1gb-nyc1-01.ssh > 69.166.116.10.5276: Flags [P.], seq 696:860, ack 1, win 501, length 164
00:19:00.817777 IP 69.166.116.10.5276 > ubuntu-s-1vcpu-1gb-nyc1-01.ssh: Flags [.], ack 696, win 510, length 0
00:19:00.817778 IP 69.166.116.10.5276 > ubuntu-s-1vcpu-1gb-nyc1-01.ssh: Flags [.], ack 860, win 509, length 0
00:19:00.817821 IP ubuntu-s-1vcpu-1gb-nyc1-01.ssh > 69.166.116.10.5276: Flags [P.], seq 860:2072, ack 1, win 501, length 1212
00:19:00.817963 IP ubuntu-s-1vcpu-1gb-nyc1-01.ssh > 69.166.116.10.5276: Flags [P.], seq 2072:2220, ack 1, win 501, length 148
00:19:00.818001 IP ubuntu-s-1vcpu-1gb-nyc1-01.ssh > 69.166.116.10.5276: Flags [P.], seq 2220:2256, ack 1, win 501, length 36
00:19:00.818038 IP ubuntu-s-1vcpu-1gb-nyc1-01.ssh > 69.166.116.10.5276: Flags [P.], seq 2256:2404, ack 1, win 501, length 148
00:19:00.818066 IP ubuntu-s-1vcpu-1gb-nyc1-01.ssh > 69.166.116.10.5276: Flags [P.], seq 2404:2440, ack 1, win 501, length 36
00:19:00.818100 IP ubuntu-s-1vcpu-1gb-nyc1-01.ssh > 69.166.116.10.5276: Flags [P.], seq 2440:2604, ack 1, win 501, length 164
00:19:00.818125 IP ubuntu-s-1vcpu-1gb-nyc1-01.ssh > 69.166.116.10.5276: Flags [P.], seq 2604:2640, ack 1, win 501, length 36
00:19:00.818158 IP ubuntu-s-1vcpu-1gb-nyc1-01.ssh > 69.166.116.10.5276: Flags [P.], seq 2640:2804, ack 1, win 501, length 164
00:19:00.818184 IP ubuntu-s-1vcpu-1gb-nyc1-01.ssh > 69.166.116.10.5276: Flags [P.], seq 2804:2840, ack 1, win 501, length 36
00:19:00.818216 IP ubuntu-s-1vcpu-1gb-nyc1-01.ssh > 69.166.116.10.5276: Flags [P.], seq 2840:3004, ack 1, win 501, length 164
00:19:00.818242 IP ubuntu-s-1vcpu-1gb-nyc1-01.ssh > 69.166.116.10.5276: Flags [P.], seq 3004:3040, ack 1, win 501, length 36
00:19:00.818275 IP ubuntu-s-1vcpu-1gb-nyc1-01.ssh > 69.166.116.10.5276: Flags [P.], seq 3040:3204, ack 1, win 501, length 164
00:19:00.818301 IP ubuntu-s-1vcpu-1gb-nyc1-01.ssh > 69.166.116.10.5276: Flags [P.], seq 3204:3240, ack 1, win 501, length 36
00:19:00.818333 IP ubuntu-s-1vcpu-1gb-nyc1-01.ssh > 69.166.116.10.5276: Flags [P.], seq 3240:3404, ack 1, win 501, length 164
00:19:00.818360 IP ubuntu-s-1vcpu-1gb-nyc1-01.ssh > 69.166.116.10.5276: Flags [P.], seq 3404:3440, ack 1, win 501, length 36
00:19:00.818392 IP ubuntu-s-1vcpu-1gb-nyc1-01.ssh > 69.166.116.10.5276: Flags [P.], seq 3440:3604, ack 1, win 501, length 164
00:19:00.818419 IP ubuntu-s-1vcpu-1gb-nyc1-01.ssh > 69.166.116.10.5276: Flags [P.], seq 3604:3640, ack 1, win 501, length 36
00:19:00.818461 IP ubuntu-s-1vcpu-1gb-nyc1-01.ssh > 69.166.116.10.5276: Flags [P.], seq 3640:3804, ack 1, win 501, length 164
00:19:00.818495 IP ubuntu-s-1vcpu-1gb-nyc1-01.ssh > 69.166.116.10.5276: Flags [P.], seq 3804:3840, ack 1, win 501, length 36
00:19:00.818530 IP ubuntu-s-1vcpu-1gb-nyc1-01.ssh > 69.166.116.10.5276: Flags [P.], seq 3840:4004, ack 1, win 501, length 164
00:19:00.832378 IP 69.166.116.10.5276 > ubuntu-s-1vcpu-1gb-nyc1-01.ssh: Flags [.], ack 4004, win 513, length 0
00:19:00.832421 IP ubuntu-s-1vcpu-1gb-nyc1-01.ssh > 69.166.116.10.5276: Flags [P.], seq 4004:6440, ack 1, win 501, length 2436
00:19:00.832547 IP ubuntu-s-1vcpu-1gb-nyc1-01.ssh > 69.166.116.10.5276: Flags [P.], seq 6440:6588, ack 1, win 501, length 148
00:19:00.832579 IP ubuntu-s-1vcpu-1gb-nyc1-01.ssh > 69.166.116.10.5276: Flags [P.], seq 6588:6624, ack 1, win 501, length 36
00:19:00.832614 IP ubuntu-s-1vcpu-1gb-nyc1-01.ssh > 69.166.116.10.5276: Flags [P.], seq 6624:6788, ack 1, win 501, length 164
00:19:00.832641 IP ubuntu-s-1vcpu-1gb-nyc1-01.ssh > 69.166.116.10.5276: Flags [P.], seq 6788:6824, ack 1, win 501, length 36
00:19:00.832673 IP ubuntu-s-1vcpu-1gb-nyc1-01.ssh > 69.166.116.10.5276: Flags [P.], seq 6824:6988, ack 1, win 501, length 164
00:19:00.832700 IP ubuntu-s-1vcpu-1gb-nyc1-01.ssh > 69.166.116.10.5276: Flags [P.], seq 6988:7024, ack 1, win 501, length 36
00:19:00.832732 IP ubuntu-s-1vcpu-1gb-nyc1-01.ssh > 69.166.116.10.5276: Flags [P.], seq 7024:7188, ack 1, win 501, length 164
00:19:00.832759 IP ubuntu-s-1vcpu-1gb-nyc1-01.ssh > 69.166.116.10.5276: Flags [P.], seq 7188:7224, ack 1, win 501, length 36
00:19:00.832791 IP ubuntu-s-1vcpu-1gb-nyc1-01.ssh > 69.166.116.10.5276: Flags [P.], seq 7224:7388, ack 1, win 501, length 164
00:19:00.832815 IP ubuntu-s-1vcpu-1gb-nyc1-01.ssh > 69.166.116.10.5276: Flags [P.], seq 7388:7424, ack 1, win 501, length 36
00:19:00.832846 IP ubuntu-s-1vcpu-1gb-nyc1-01.ssh > 69.166.116.10.5276: Flags [P.], seq 7424:7588, ack 1, win 501, length 164
00:19:00.832870 IP ubuntu-s-1vcpu-1gb-nyc1-01.ssh > 69.166.116.10.5276: Flags [P.], seq 7588:7624, ack 1, win 501, length 36
00:19:00.832901 IP ubuntu-s-1vcpu-1gb-nyc1-01.ssh > 69.166.116.10.5276: Flags [P.], seq 7624:7788, ack 1, win 501, length 164
00:19:00.832925 IP ubuntu-s-1vcpu-1gb-nyc1-01.ssh > 69.166.116.10.5276: Flags [P.], seq 7788:7824, ack 1, win 501, length 36
00:19:00.832956 IP ubuntu-s-1vcpu-1gb-nyc1-01.ssh > 69.166.116.10.5276: Flags [P.], seq 7824:7988, ack 1, win 501, length 164
00:19:00.832982 IP ubuntu-s-1vcpu-1gb-nyc1-01.ssh > 69.166.116.10.5276: Flags [P.], seq 7988:8024, ack 1, win 501, length 36
00:19:00.833014 IP ubuntu-s-1vcpu-1gb-nyc1-01.ssh > 69.166.116.10.5276: Flags [P.], seq 8024:8188, ack 1, win 501, length 164
00:19:00.833040 IP ubuntu-s-1vcpu-1gb-nyc1-01.ssh > 69.166.116.10.5276: Flags [P.], seq 8188:8224, ack 1, win 501, length 36
00:19:00.833071 IP ubuntu-s-1vcpu-1gb-nyc1-01.ssh > 69.166.116.10.5276: Flags [P.], seq 8224:8388, ack 1, win 501, length 164
00:19:00.833118 IP ubuntu-s-1vcpu-1gb-nyc1-01.ssh > 69.166.116.10.5276: Flags [P.], seq 8388:8424, ack 1, win 501, length 36
00:19:00.833163 IP ubuntu-s-1vcpu-1gb-nyc1-01.ssh > 69.166.116.10.5276: Flags [P.], seq 8424:8588, ack 1, win 501, length 164
00:19:00.833200 IP ubuntu-s-1vcpu-1gb-nyc1-01.ssh > 69.166.116.10.5276: Flags [P.], seq 8588:8624, ack 1, win 501, length 36
00:19:00.833245 IP ubuntu-s-1vcpu-1gb-nyc1-01.ssh > 69.166.116.10.5276: Flags [P.], seq 8624:8788, ack 1, win 501, length 164
00:19:00.833275 IP ubuntu-s-1vcpu-1gb-nyc1-01.ssh > 69.166.116.10.5276: Flags [P.], seq 8788:8824, ack 1, win 501, length 36
00:19:00.833316 IP ubuntu-s-1vcpu-1gb-nyc1-01.ssh > 69.166.116.10.5276: Flags [P.], seq 8824:8988, ack 1, win 501, length 164
00:19:00.833348 IP ubuntu-s-1vcpu-1gb-nyc1-01.ssh > 69.166.116.10.5276: Flags [P.], seq 8988:9024, ack 1, win 501, length 36
00:19:00.833380 IP ubuntu-s-1vcpu-1gb-nyc1-01.ssh > 69.166.116.10.5276: Flags [P.], seq 9024:9188, ack 1, win 501, length 164
00:19:00.833403 IP ubuntu-s-1vcpu-1gb-nyc1-01.ssh > 69.166.116.10.5276: Flags [P.], seq 9188:9224, ack 1, win 501, length 36
00:19:00.833433 IP ubuntu-s-1vcpu-1gb-nyc1-01.ssh > 69.166.116.10.5276: Flags [P.], seq 9224:9388, ack 1, win 501, length 164
00:19:00.833458 IP ubuntu-s-1vcpu-1gb-nyc1-01.ssh > 69.166.116.10.5276: Flags [P.], seq 9388:9424, ack 1, win 501, length 36
00:19:00.847307 IP 69.166.116.10.5276 > ubuntu-s-1vcpu-1gb-nyc1-01.ssh: Flags [.], ack 9388, win 513, length 0
00:19:00.847377 IP ubuntu-s-1vcpu-1gb-nyc1-01.ssh > 69.166.116.10.5276: Flags [P.], seq 9424:12344, ack 1, win 501, length 2920
00:19:00.847419 IP ubuntu-s-1vcpu-1gb-nyc1-01.ssh > 69.166.116.10.5276: Flags [P.], seq 12344:12824, ack 1, win 501, length 480
00:19:00.847535 IP ubuntu-s-1vcpu-1gb-nyc1-01.ssh > 69.166.116.10.5276: Flags [P.], seq 12824:12972, ack 1, win 501, length 148
00:19:00.847568 IP ubuntu-s-1vcpu-1gb-nyc1-01.ssh > 69.166.116.10.5276: Flags [P.], seq 12972:13008, ack 1, win 501, length 36
00:19:00.847615 IP ubuntu-s-1vcpu-1gb-nyc1-01.ssh > 69.166.116.10.5276: Flags [P.], seq 13008:13172, ack 1, win 501, length 164
00:19:00.847641 IP ubuntu-s-1vcpu-1gb-nyc1-01.ssh > 69.166.116.10.5276: Flags [P.], seq 13172:13208, ack 1, win 501, length 36
00:19:00.847672 IP ubuntu-s-1vcpu-1gb-nyc1-01.ssh > 69.166.116.10.5276: Flags [P.], seq 13208:13372, ack 1, win 501, length 164
00:19:00.847715 IP ubuntu-s-1vcpu-1gb-nyc1-01.ssh > 69.166.116.10.5276: Flags [P.], seq 13372:13408, ack 1, win 501, length 36
00:19:00.847747 IP ubuntu-s-1vcpu-1gb-nyc1-01.ssh > 69.166.116.10.5276: Flags [P.], seq 13408:13572, ack 1, win 501, length 164
00:19:00.847773 IP ubuntu-s-1vcpu-1gb-nyc1-01.ssh > 69.166.116.10.5276: Flags [P.], seq 13572:13608, ack 1, win 501, length 36
00:19:00.847804 IP ubuntu-s-1vcpu-1gb-nyc1-01.ssh > 69.166.116.10.5276: Flags [P.], seq 13608:13772, ack 1, win 501, length 164
00:19:00.847831 IP ubuntu-s-1vcpu-1gb-nyc1-01.ssh > 69.166.116.10.5276: Flags [P.], seq 13772:13808, ack 1, win 501, length 36
00:19:00.847861 IP ubuntu-s-1vcpu-1gb-nyc1-01.ssh > 69.166.116.10.5276: Flags [P.], seq 13808:13972, ack 1, win 501, length 164
00:19:00.847886 IP ubuntu-s-1vcpu-1gb-nyc1-01.ssh > 69.166.116.10.5276: Flags [P.], seq 13972:14008, ack 1, win 501, length 36
00:19:00.847928 IP ubuntu-s-1vcpu-1gb-nyc1-01.ssh > 69.166.116.10.5276: Flags [P.], seq 14008:14172, ack 1, win 501, length 164
00:19:00.847966 IP ubuntu-s-1vcpu-1gb-nyc1-01.ssh > 69.166.116.10.5276: Flags [P.], seq 14172:14208, ack 1, win 501, length 36
00:19:00.847997 IP ubuntu-s-1vcpu-1gb-nyc1-01.ssh > 69.166.116.10.5276: Flags [P.], seq 14208:14372, ack 1, win 501, length 164
00:19:00.848022 IP ubuntu-s-1vcpu-1gb-nyc1-01.ssh > 69.166.116.10.5276: Flags [P.], seq 14372:14408, ack 1, win 501, length 36
00:19:00.848052 IP ubuntu-s-1vcpu-1gb-nyc1-01.ssh > 69.166.116.10.5276: Flags [P.], seq 14408:14572, ack 1, win 501, length 164
00:19:00.848076 IP ubuntu-s-1vcpu-1gb-nyc1-01.ssh > 69.166.116.10.5276: Flags [P.], seq 14572:14608, ack 1, win 501, length 36
00:19:00.848106 IP ubuntu-s-1vcpu-1gb-nyc1-01.ssh > 69.166.116.10.5276: Flags [P.], seq 14608:14772, ack 1, win 501, length 164
00:19:00.848129 IP ubuntu-s-1vcpu-1gb-nyc1-01.ssh > 69.166.116.10.5276: Flags [P.], seq 14772:14808, ack 1, win 501, length 36
00:19:00.848159 IP ubuntu-s-1vcpu-1gb-nyc1-01.ssh > 69.166.116.10.5276: Flags [P.], seq 14808:14972, ack 1, win 501, length 164
00:19:00.848185 IP ubuntu-s-1vcpu-1gb-nyc1-01.ssh > 69.166.116.10.5276: Flags [P.], seq 14972:15008, ack 1, win 501, length 36
00:19:00.848215 IP ubuntu-s-1vcpu-1gb-nyc1-01.ssh > 69.166.116.10.5276: Flags [P.], seq 15008:15172, ack 1, win 501, length 164
00:19:00.848240 IP ubuntu-s-1vcpu-1gb-nyc1-01.ssh > 69.166.116.10.5276: Flags [P.], seq 15172:15208, ack 1, win 501, length 36
00:19:00.848287 IP ubuntu-s-1vcpu-1gb-nyc1-01.ssh > 69.166.116.10.5276: Flags [P.], seq 15208:15372, ack 1, win 501, length 164
00:19:00.848312 IP ubuntu-s-1vcpu-1gb-nyc1-01.ssh > 69.166.116.10.5276: Flags [P.], seq 15372:15408, ack 1, win 501, length 36
00:19:00.848343 IP ubuntu-s-1vcpu-1gb-nyc1-01.ssh > 69.166.116.10.5276: Flags [P.], seq 15408:15572, ack 1, win 501, length 164
00:19:00.848391 IP ubuntu-s-1vcpu-1gb-nyc1-01.ssh > 69.166.116.10.5276: Flags [P.], seq 15572:15608, ack 1, win 501, length 36
00:19:00.861992 IP 69.166.116.10.5276 > ubuntu-s-1vcpu-1gb-nyc1-01.ssh: Flags [.], ack 9424, win 513, length 0
00:19:00.862029 IP ubuntu-s-1vcpu-1gb-nyc1-01.ssh > 69.166.116.10.5276: Flags [.], seq 15608:17068, ack 1, win 501, length 1460
00:19:00.867258 IP 69.166.116.10.5276 > ubuntu-s-1vcpu-1gb-nyc1-01.ssh: Flags [.], ack 12344, win 513, length 0
00:19:00.867259 IP 69.166.116.10.5276 > ubuntu-s-1vcpu-1gb-nyc1-01.ssh: Flags [.], ack 15572, win 513, length 0
00:19:00.867259 IP 69.166.116.10.5276 > ubuntu-s-1vcpu-1gb-nyc1-01.ssh: Flags [P.], seq 1:37, ack 15572, win 513, length 36
00:19:00.867287 IP ubuntu-s-1vcpu-1gb-nyc1-01.ssh > 69.166.116.10.5276: Flags [P.], seq 17068:19392, ack 1, win 501, length 2324
00:19:00.867408 IP ubuntu-s-1vcpu-1gb-nyc1-01.ssh > 69.166.116.10.5276: Flags [P.], seq 19392:19540, ack 37, win 501, length 148
00:19:00.867438 IP ubuntu-s-1vcpu-1gb-nyc1-01.ssh > 69.166.116.10.5276: Flags [P.], seq 19540:19576, ack 37, win 501, length 36
00:19:00.867470 IP ubuntu-s-1vcpu-1gb-nyc1-01.ssh > 69.166.116.10.5276: Flags [P.], seq 19576:19724, ack 37, win 501, length 148
00:19:00.867496 IP ubuntu-s-1vcpu-1gb-nyc1-01.ssh > 69.166.116.10.5276: Flags [P.], seq 19724:19760, ack 37, win 501, length 36
00:19:00.867528 IP ubuntu-s-1vcpu-1gb-nyc1-01.ssh > 69.166.116.10.5276: Flags [P.], seq 19760:19924, ack 37, win 501, length 164
00:19:00.867554 IP ubuntu-s-1vcpu-1gb-nyc1-01.ssh > 69.166.116.10.5276: Flags [P.], seq 19924:19960, ack 37, win 501, length 36
00:19:00.867585 IP ubuntu-s-1vcpu-1gb-nyc1-01.ssh > 69.166.116.10.5276: Flags [P.], seq 19960:20124, ack 37, win 501, length 164
00:19:00.867609 IP ubuntu-s-1vcpu-1gb-nyc1-01.ssh > 69.166.116.10.5276: Flags [P.], seq 20124:20160, ack 37, win 501, length 36
00:19:00.867639 IP ubuntu-s-1vcpu-1gb-nyc1-01.ssh > 69.166.116.10.5276: Flags [P.], seq 20160:20324, ack 37, win 501, length 164
00:19:00.867665 IP ubuntu-s-1vcpu-1gb-nyc1-01.ssh > 69.166.116.10.5276: Flags [P.], seq 20324:20360, ack 37, win 501, length 36
00:19:00.867695 IP ubuntu-s-1vcpu-1gb-nyc1-01.ssh > 69.166.116.10.5276: Flags [P.], seq 20360:20524, ack 37, win 501, length 164
00:19:00.867720 IP ubuntu-s-1vcpu-1gb-nyc1-01.ssh > 69.166.116.10.5276: Flags [P.], seq 20524:20560, ack 37, win 501, length 36
00:19:00.867750 IP ubuntu-s-1vcpu-1gb-nyc1-01.ssh > 69.166.116.10.5276: Flags [P.], seq 20560:20724, ack 37, win 501, length 164
00:19:00.867782 IP ubuntu-s-1vcpu-1gb-nyc1-01.ssh > 69.166.116.10.5276: Flags [P.], seq 20724:20760, ack 37, win 501, length 36
00:19:00.867813 IP ubuntu-s-1vcpu-1gb-nyc1-01.ssh > 69.166.116.10.5276: Flags [P.], seq 20760:20924, ack 37, win 501, length 164
00:19:00.867838 IP ubuntu-s-1vcpu-1gb-nyc1-01.ssh > 69.166.116.10.5276: Flags [P.], seq 20924:20960, ack 37, win 501, length 36
00:19:00.867868 IP ubuntu-s-1vcpu-1gb-nyc1-01.ssh > 69.166.116.10.5276: Flags [P.], seq 20960:21124, ack 37, win 501, length 164
00:19:00.867893 IP ubuntu-s-1vcpu-1gb-nyc1-01.ssh > 69.166.116.10.5276: Flags [P.], seq 21124:21160, ack 37, win 501, length 36
00:19:00.867935 IP ubuntu-s-1vcpu-1gb-nyc1-01.ssh > 69.166.116.10.5276: Flags [P.], seq 21160:21324, ack 37, win 501, length 164
00:19:00.867960 IP ubuntu-s-1vcpu-1gb-nyc1-01.ssh > 69.166.116.10.5276: Flags [P.], seq 21324:21360, ack 37, win 501, length 36
00:19:00.868008 IP ubuntu-s-1vcpu-1gb-nyc1-01.ssh > 69.166.116.10.5276: Flags [P.], seq 21360:21524, ack 37, win 501, length 164
00:19:00.868035 IP ubuntu-s-1vcpu-1gb-nyc1-01.ssh > 69.166.116.10.5276: Flags [P.], seq 21524:21560, ack 37, win 501, length 36
00:19:00.868065 IP ubuntu-s-1vcpu-1gb-nyc1-01.ssh > 69.166.116.10.5276: Flags [P.], seq 21560:21724, ack 37, win 501, length 164
00:19:00.868117 IP ubuntu-s-1vcpu-1gb-nyc1-01.ssh > 69.166.116.10.5276: Flags [P.], seq 21724:21760, ack 37, win 501, length 36
00:19:00.868152 IP ubuntu-s-1vcpu-1gb-nyc1-01.ssh > 69.166.116.10.5276: Flags [P.], seq 21760:21924, ack 37, win 501, length 164
00:19:00.868178 IP ubuntu-s-1vcpu-1gb-nyc1-01.ssh > 69.166.116.10.5276: Flags [P.], seq 21924:21960, ack 37, win 501, length 36
00:19:00.868208 IP ubuntu-s-1vcpu-1gb-nyc1-01.ssh > 69.166.116.10.5276: Flags [P.], seq 21960:22124, ack 37, win 501, length 164
00:19:00.868233 IP ubuntu-s-1vcpu-1gb-nyc1-01.ssh > 69.166.116.10.5276: Flags [P.], seq 22124:22160, ack 37, win 501, length 36
00:19:00.874985 IP 69.166.116.10.5276 > ubuntu-s-1vcpu-1gb-nyc1-01.ssh: Flags [.], ack 17068, win 513, length 0
00:19:00.875012 IP ubuntu-s-1vcpu-1gb-nyc1-01.ssh > 69.166.116.10.5276: Flags [P.], seq 22160:25080, ack 37, win 501, length 2920
00:19:00.886925 IP 69.166.116.10.5276 > ubuntu-s-1vcpu-1gb-nyc1-01.ssh: Flags [.], ack 22124, win 513, length 0
00:19:00.886966 IP ubuntu-s-1vcpu-1gb-nyc1-01.ssh > 69.166.116.10.5276: Flags [P.], seq 25080:26144, ack 37, win 501, length 1064
00:19:00.887068 IP ubuntu-s-1vcpu-1gb-nyc1-01.ssh > 69.166.116.10.5276: Flags [P.], seq 26144:26292, ack 37, win 501, length 148
00:19:00.887101 IP ubuntu-s-1vcpu-1gb-nyc1-01.ssh > 69.166.116.10.5276: Flags [P.], seq 26292:26328, ack 37, win 501, length 36
00:19:00.887135 IP ubuntu-s-1vcpu-1gb-nyc1-01.ssh > 69.166.116.10.5276: Flags [P.], seq 26328:26492, ack 37, win 501, length 164
00:19:00.887161 IP ubuntu-s-1vcpu-1gb-nyc1-01.ssh > 69.166.116.10.5276: Flags [P.], seq 26492:26528, ack 37, win 501, length 36
00:19:00.887192 IP ubuntu-s-1vcpu-1gb-nyc1-01.ssh > 69.166.116.10.5276: Flags [P.], seq 26528:26692, ack 37, win 501, length 164
00:19:00.887216 IP ubuntu-s-1vcpu-1gb-nyc1-01.ssh > 69.166.116.10.5276: Flags [P.], seq 26692:26728, ack 37, win 501, length 36
00:19:00.887246 IP ubuntu-s-1vcpu-1gb-nyc1-01.ssh > 69.166.116.10.5276: Flags [P.], seq 26728:26892, ack 37, win 501, length 164
00:19:00.887271 IP ubuntu-s-1vcpu-1gb-nyc1-01.ssh > 69.166.116.10.5276: Flags [P.], seq 26892:26928, ack 37, win 501, length 36
00:19:00.887301 IP ubuntu-s-1vcpu-1gb-nyc1-01.ssh > 69.166.116.10.5276: Flags [P.], seq 26928:27092, ack 37, win 501, length 164
00:19:00.887325 IP ubuntu-s-1vcpu-1gb-nyc1-01.ssh > 69.166.116.10.5276: Flags [P.], seq 27092:27128, ack 37, win 501, length 36
00:19:00.887355 IP ubuntu-s-1vcpu-1gb-nyc1-01.ssh > 69.166.116.10.5276: Flags [P.], seq 27128:27292, ack 37, win 501, length 164
00:19:00.887380 IP ubuntu-s-1vcpu-1gb-nyc1-01.ssh > 69.166.116.10.5276: Flags [P.], seq 27292:27328, ack 37, win 501, length 36
00:19:00.887410 IP ubuntu-s-1vcpu-1gb-nyc1-01.ssh > 69.166.116.10.5276: Flags [P.], seq 27328:27492, ack 37, win 501, length 164
00:19:00.887433 IP ubuntu-s-1vcpu-1gb-nyc1-01.ssh > 69.166.116.10.5276: Flags [P.], seq 27492:27528, ack 37, win 501, length 36
00:19:00.887463 IP ubuntu-s-1vcpu-1gb-nyc1-01.ssh > 69.166.116.10.5276: Flags [P.], seq 27528:27692, ack 37, win 501, length 164
00:19:00.887486 IP ubuntu-s-1vcpu-1gb-nyc1-01.ssh > 69.166.116.10.5276: Flags [P.], seq 27692:27728, ack 37, win 501, length 36
00:19:00.887516 IP ubuntu-s-1vcpu-1gb-nyc1-01.ssh > 69.166.116.10.5276: Flags [P.], seq 27728:27892, ack 37, win 501, length 164
00:19:00.887540 IP ubuntu-s-1vcpu-1gb-nyc1-01.ssh > 69.166.116.10.5276: Flags [P.], seq 27892:27928, ack 37, win 501, length 36
00:19:00.887570 IP ubuntu-s-1vcpu-1gb-nyc1-01.ssh > 69.166.116.10.5276: Flags [P.], seq 27928:28092, ack 37, win 501, length 164
00:19:00.887593 IP ubuntu-s-1vcpu-1gb-nyc1-01.ssh > 69.166.116.10.5276: Flags [P.], seq 28092:28128, ack 37, win 501, length 36
00:19:00.887626 IP ubuntu-s-1vcpu-1gb-nyc1-01.ssh > 69.166.116.10.5276: Flags [P.], seq 28128:28292, ack 37, win 501, length 164
00:19:00.887652 IP ubuntu-s-1vcpu-1gb-nyc1-01.ssh > 69.166.116.10.5276: Flags [P.], seq 28292:28328, ack 37, win 501, length 36
00:19:00.887681 IP ubuntu-s-1vcpu-1gb-nyc1-01.ssh > 69.166.116.10.5276: Flags [P.], seq 28328:28492, ack 37, win 501, length 164
00:19:00.887705 IP ubuntu-s-1vcpu-1gb-nyc1-01.ssh > 69.166.116.10.5276: Flags [P.], seq 28492:28528, ack 37, win 501, length 36
00:19:00.887735 IP ubuntu-s-1vcpu-1gb-nyc1-01.ssh > 69.166.116.10.5276: Flags [P.], seq 28528:28692, ack 37, win 501, length 164
00:19:00.887758 IP ubuntu-s-1vcpu-1gb-nyc1-01.ssh > 69.166.116.10.5276: Flags [P.], seq 28692:28728, ack 37, win 501, length 36
00:19:00.887788 IP ubuntu-s-1vcpu-1gb-nyc1-01.ssh > 69.166.116.10.5276: Flags [P.], seq 28728:28892, ack 37, win 501, length 164
00:19:00.887812 IP ubuntu-s-1vcpu-1gb-nyc1-01.ssh > 69.166.116.10.5276: Flags [P.], seq 28892:28928, ack 37, win 501, length 36
00:19:00.888423 IP 69.166.116.10.5276 > ubuntu-s-1vcpu-1gb-nyc1-01.ssh: Flags [.], ack 22160, win 513, length 0
00:19:00.888423 IP 69.166.116.10.5276 > ubuntu-s-1vcpu-1gb-nyc1-01.ssh: Flags [.], ack 25080, win 513, length 0
00:19:00.888435 IP ubuntu-s-1vcpu-1gb-nyc1-01.ssh > 69.166.116.10.5276: Flags [P.], seq 28928:31848, ack 37, win 501, length 2920
00:19:00.888454 IP ubuntu-s-1vcpu-1gb-nyc1-01.ssh > 69.166.116.10.5276: Flags [P.], seq 31848:32128, ack 37, win 501, length 280
00:19:00.901821 IP 69.166.116.10.5276 > ubuntu-s-1vcpu-1gb-nyc1-01.ssh: Flags [.], ack 28892, win 513, length 0
00:19:00.901821 IP 69.166.116.10.5276 > ubuntu-s-1vcpu-1gb-nyc1-01.ssh: Flags [.], ack 30388, win 513, length 0
00:19:00.901870 IP ubuntu-s-1vcpu-1gb-nyc1-01.ssh > 69.166.116.10.5276: Flags [P.], seq 32128:32896, ack 37, win 501, length 768
00:19:00.902000 IP ubuntu-s-1vcpu-1gb-nyc1-01.ssh > 69.166.116.10.5276: Flags [P.], seq 32896:33044, ack 37, win 501, length 148
00:19:00.902048 IP ubuntu-s-1vcpu-1gb-nyc1-01.ssh > 69.166.116.10.5276: Flags [P.], seq 33044:33080, ack 37, win 501, length 36
00:19:00.902102 IP ubuntu-s-1vcpu-1gb-nyc1-01.ssh > 69.166.116.10.5276: Flags [P.], seq 33080:33228, ack 37, win 501, length 148
00:19:00.902130 IP ubuntu-s-1vcpu-1gb-nyc1-01.ssh > 69.166.116.10.5276: Flags [P.], seq 33228:33264, ack 37, win 501, length 36
00:19:00.902165 IP ubuntu-s-1vcpu-1gb-nyc1-01.ssh > 69.166.116.10.5276: Flags [P.], seq 33264:33428, ack 37, win 501, length 164
00:19:00.902192 IP ubuntu-s-1vcpu-1gb-nyc1-01.ssh > 69.166.116.10.5276: Flags [P.], seq 33428:33464, ack 37, win 501, length 36
00:19:00.902225 IP ubuntu-s-1vcpu-1gb-nyc1-01.ssh > 69.166.116.10.5276: Flags [P.], seq 33464:33628, ack 37, win 501, length 164
00:19:00.902251 IP ubuntu-s-1vcpu-1gb-nyc1-01.ssh > 69.166.116.10.5276: Flags [P.], seq 33628:33664, ack 37, win 501, length 36
00:19:00.902283 IP ubuntu-s-1vcpu-1gb-nyc1-01.ssh > 69.166.116.10.5276: Flags [P.], seq 33664:33828, ack 37, win 501, length 164
00:19:00.902307 IP ubuntu-s-1vcpu-1gb-nyc1-01.ssh > 69.166.116.10.5276: Flags [P.], seq 33828:33864, ack 37, win 501, length 36
00:19:00.902338 IP ubuntu-s-1vcpu-1gb-nyc1-01.ssh > 69.166.116.10.5276: Flags [P.], seq 33864:34028, ack 37, win 501, length 164
00:19:00.902376 IP ubuntu-s-1vcpu-1gb-nyc1-01.ssh > 69.166.116.10.5276: Flags [P.], seq 34028:34064, ack 37, win 501, length 36
00:19:00.902397 IP ubuntu-s-1vcpu-1gb-nyc1-01.ssh > 69.166.116.10.5276: Flags [P.], seq 34064:34228, ack 37, win 501, length 164
00:19:00.902422 IP ubuntu-s-1vcpu-1gb-nyc1-01.ssh > 69.166.116.10.5276: Flags [P.], seq 34228:34264, ack 37, win 501, length 36
00:19:00.902453 IP ubuntu-s-1vcpu-1gb-nyc1-01.ssh > 69.166.116.10.5276: Flags [P.], seq 34264:34428, ack 37, win 501, length 164
00:19:00.902478 IP ubuntu-s-1vcpu-1gb-nyc1-01.ssh > 69.166.116.10.5276: Flags [P.], seq 34428:34464, ack 37, win 501, length 36
00:19:00.902509 IP ubuntu-s-1vcpu-1gb-nyc1-01.ssh > 69.166.116.10.5276: Flags [P.], seq 34464:34628, ack 37, win 501, length 164
00:19:00.902535 IP ubuntu-s-1vcpu-1gb-nyc1-01.ssh > 69.166.116.10.5276: Flags [P.], seq 34628:34664, ack 37, win 501, length 36
00:19:00.902545 IP 69.166.116.10.5276 > ubuntu-s-1vcpu-1gb-nyc1-01.ssh: Flags [.], ack 32128, win 513, length 0
00:19:00.902575 IP ubuntu-s-1vcpu-1gb-nyc1-01.ssh > 69.166.116.10.5276: Flags [P.], seq 34664:34828, ack 37, win 501, length 164
00:19:00.902602 IP ubuntu-s-1vcpu-1gb-nyc1-01.ssh > 69.166.116.10.5276: Flags [P.], seq 34828:34864, ack 37, win 501, length 36
00:19:00.902633 IP ubuntu-s-1vcpu-1gb-nyc1-01.ssh > 69.166.116.10.5276: Flags [P.], seq 34864:35028, ack 37, win 501, length 164
00:19:00.902670 IP ubuntu-s-1vcpu-1gb-nyc1-01.ssh > 69.166.116.10.5276: Flags [P.], seq 35028:35064, ack 37, win 501, length 36
00:19:00.902702 IP ubuntu-s-1vcpu-1gb-nyc1-01.ssh > 69.166.116.10.5276: Flags [P.], seq 35064:35228, ack 37, win 501, length 164
00:19:00.902728 IP ubuntu-s-1vcpu-1gb-nyc1-01.ssh > 69.166.116.10.5276: Flags [P.], seq 35228:35264, ack 37, win 501, length 36
00:19:00.902760 IP ubuntu-s-1vcpu-1gb-nyc1-01.ssh > 69.166.116.10.5276: Flags [P.], seq 35264:35428, ack 37, win 501, length 164
00:19:00.902786 IP ubuntu-s-1vcpu-1gb-nyc1-01.ssh > 69.166.116.10.5276: Flags [P.], seq 35428:35464, ack 37, win 501, length 36
00:19:00.902817 IP ubuntu-s-1vcpu-1gb-nyc1-01.ssh > 69.166.116.10.5276: Flags [P.], seq 35464:35628, ack 37, win 501, length 164
00:19:00.902841 IP ubuntu-s-1vcpu-1gb-nyc1-01.ssh > 69.166.116.10.5276: Flags [P.], seq 35628:35664, ack 37, win 501, length 36
00:19:00.902872 IP ubuntu-s-1vcpu-1gb-nyc1-01.ssh > 69.166.116.10.5276: Flags [P.], seq 35664:35828, ack 37, win 501, length 164
00:19:00.902898 IP ubuntu-s-1vcpu-1gb-nyc1-01.ssh > 69.166.116.10.5276: Flags [P.], seq 35828:35864, ack 37, win 501, length 36
00:19:00.902929 IP ubuntu-s-1vcpu-1gb-nyc1-01.ssh > 69.166.116.10.5276: Flags [P.], seq 35864:36028, ack 37, win 501, length 164
00:19:00.917860 IP 69.166.116.10.5276 > ubuntu-s-1vcpu-1gb-nyc1-01.ssh: Flags [.], ack 33044, win 509, length 0
00:19:00.917860 IP 69.166.116.10.5276 > ubuntu-s-1vcpu-1gb-nyc1-01.ssh: Flags [.], ack 36028, win 513, length 0
00:19:00.917908 IP ubuntu-s-1vcpu-1gb-nyc1-01.ssh > 69.166.116.10.5276: Flags [P.], seq 36028:38948, ack 37, win 501, length 2920
00:19:00.917962 IP ubuntu-s-1vcpu-1gb-nyc1-01.ssh > 69.166.116.10.5276: Flags [P.], seq 38948:39096, ack 37, win 501, length 148
00:19:00.918074 IP ubuntu-s-1vcpu-1gb-nyc1-01.ssh > 69.166.116.10.5276: Flags [P.], seq 39096:39244, ack 37, win 501, length 148
00:19:00.918170 IP ubuntu-s-1vcpu-1gb-nyc1-01.ssh > 69.166.116.10.5276: Flags [P.], seq 39244:39784, ack 37, win 501, length 540
00:19:00.918215 IP ubuntu-s-1vcpu-1gb-nyc1-01.ssh > 69.166.116.10.5276: Flags [P.], seq 39784:39948, ack 37, win 501, length 164
00:19:00.918255 IP ubuntu-s-1vcpu-1gb-nyc1-01.ssh > 69.166.116.10.5276: Flags [P.], seq 39948:40112, ack 37, win 501, length 164
00:19:00.918293 IP ubuntu-s-1vcpu-1gb-nyc1-01.ssh > 69.166.116.10.5276: Flags [P.], seq 40112:40276, ack 37, win 501, length 164
00:19:00.918331 IP ubuntu-s-1vcpu-1gb-nyc1-01.ssh > 69.166.116.10.5276: Flags [P.], seq 40276:40440, ack 37, win 501, length 164
00:19:00.918368 IP ubuntu-s-1vcpu-1gb-nyc1-01.ssh > 69.166.116.10.5276: Flags [P.], seq 40440:40604, ack 37, win 501, length 164
00:19:00.918405 IP ubuntu-s-1vcpu-1gb-nyc1-01.ssh > 69.166.116.10.5276: Flags [P.], seq 40604:40768, ack 37, win 501, length 164
00:19:00.918442 IP ubuntu-s-1vcpu-1gb-nyc1-01.ssh > 69.166.116.10.5276: Flags [P.], seq 40768:40932, ack 37, win 501, length 164
00:19:00.918490 IP ubuntu-s-1vcpu-1gb-nyc1-01.ssh > 69.166.116.10.5276: Flags [P.], seq 40932:41096, ack 37, win 501, length 164
00:19:00.918544 IP ubuntu-s-1vcpu-1gb-nyc1-01.ssh > 69.166.116.10.5276: Flags [P.], seq 41096:41260, ack 37, win 501, length 164
00:19:00.918581 IP ubuntu-s-1vcpu-1gb-nyc1-01.ssh > 69.166.116.10.5276: Flags [P.], seq 41260:41424, ack 37, win 501, length 164
00:19:00.918631 IP ubuntu-s-1vcpu-1gb-nyc1-01.ssh > 69.166.116.10.5276: Flags [P.], seq 41424:41588, ack 37, win 501, length 164
00:19:00.918685 IP ubuntu-s-1vcpu-1gb-nyc1-01.ssh > 69.166.116.10.5276: Flags [P.], seq 41588:41752, ack 37, win 501, length 164
00:19:00.918723 IP ubuntu-s-1vcpu-1gb-nyc1-01.ssh > 69.166.116.10.5276: Flags [P.], seq 41752:41916, ack 37, win 501, length 164
00:19:00.918760 IP ubuntu-s-1vcpu-1gb-nyc1-01.ssh > 69.166.116.10.5276: Flags [P.], seq 41916:42080, ack 37, win 501, length 164
00:19:00.918796 IP ubuntu-s-1vcpu-1gb-nyc1-01.ssh > 69.166.116.10.5276: Flags [P.], seq 42080:42244, ack 37, win 501, length 164
00:19:00.918833 IP ubuntu-s-1vcpu-1gb-nyc1-01.ssh > 69.166.116.10.5276: Flags [P.], seq 42244:42408, ack 37, win 501, length 164
00:19:00.918870 IP ubuntu-s-1vcpu-1gb-nyc1-01.ssh > 69.166.116.10.5276: Flags [P.], seq 42408:42572, ack 37, win 501, length 164
00:19:00.918907 IP ubuntu-s-1vcpu-1gb-nyc1-01.ssh > 69.166.116.10.5276: Flags [P.], seq 42572:42736, ack 37, win 501, length 164
00:19:00.918946 IP ubuntu-s-1vcpu-1gb-nyc1-01.ssh > 69.166.116.10.5276: Flags [P.], seq 42736:42900, ack 37, win 501, length 164
00:19:00.919000 IP ubuntu-s-1vcpu-1gb-nyc1-01.ssh > 69.166.116.10.5276: Flags [P.], seq 42900:43064, ack 37, win 501, length 164
00:19:00.919046 IP ubuntu-s-1vcpu-1gb-nyc1-01.ssh > 69.166.116.10.5276: Flags [P.], seq 43064:43228, ack 37, win 501, length 164
00:19:00.919084 IP ubuntu-s-1vcpu-1gb-nyc1-01.ssh > 69.166.116.10.5276: Flags [P.], seq 43228:43392, ack 37, win 501, length 164
00:19:00.919122 IP ubuntu-s-1vcpu-1gb-nyc1-01.ssh > 69.166.116.10.5276: Flags [P.], seq 43392:43556, ack 37, win 501, length 164
00:19:00.919159 IP ubuntu-s-1vcpu-1gb-nyc1-01.ssh > 69.166.116.10.5276: Flags [P.], seq 43556:43720, ack 37, win 501, length 164
00:19:00.919205 IP ubuntu-s-1vcpu-1gb-nyc1-01.ssh > 69.166.116.10.5276: Flags [P.], seq 43720:43884, ack 37, win 501, length 164
00:19:00.919256 IP ubuntu-s-1vcpu-1gb-nyc1-01.ssh > 69.166.116.10.5276: Flags [P.], seq 43884:44048, ack 37, win 501, length 164
00:19:00.919322 IP ubuntu-s-1vcpu-1gb-nyc1-01.ssh > 69.166.116.10.5276: Flags [P.], seq 44048:44212, ack 37, win 501, length 164
00:19:00.933657 IP 69.166.116.10.5276 > ubuntu-s-1vcpu-1gb-nyc1-01.ssh: Flags [.], ack 44212, win 513, length 0
00:19:00.933721 IP ubuntu-s-1vcpu-1gb-nyc1-01.ssh > 69.166.116.10.5276: Flags [P.], seq 44212:44376, ack 37, win 501, length 164
00:19:00.933901 IP ubuntu-s-1vcpu-1gb-nyc1-01.ssh > 69.166.116.10.5276: Flags [P.], seq 44376:44660, ack 37, win 501, length 284
00:19:00.933971 IP ubuntu-s-1vcpu-1gb-nyc1-01.ssh > 69.166.116.10.5276: Flags [P.], seq 44660:44824, ack 37, win 501, length 164
00:19:00.934026 IP ubuntu-s-1vcpu-1gb-nyc1-01.ssh > 69.166.116.10.5276: Flags [P.], seq 44824:44988, ack 37, win 501, length 164
00:19:00.934076 IP ubuntu-s-1vcpu-1gb-nyc1-01.ssh > 69.166.116.10.5276: Flags [P.], seq 44988:45152, ack 37, win 501, length 164
00:19:00.934126 IP ubuntu-s-1vcpu-1gb-nyc1-01.ssh > 69.166.116.10.5276: Flags [P.], seq 45152:45316, ack 37, win 501, length 164
00:19:00.934176 IP ubuntu-s-1vcpu-1gb-nyc1-01.ssh > 69.166.116.10.5276: Flags [P.], seq 45316:45480, ack 37, win 501, length 164
00:19:00.934225 IP ubuntu-s-1vcpu-1gb-nyc1-01.ssh > 69.166.116.10.5276: Flags [P.], seq 45480:45644, ack 37, win 501, length 164
00:19:00.934276 IP ubuntu-s-1vcpu-1gb-nyc1-01.ssh > 69.166.116.10.5276: Flags [P.], seq 45644:45808, ack 37, win 501, length 164
00:19:00.934325 IP ubuntu-s-1vcpu-1gb-nyc1-01.ssh > 69.166.116.10.5276: Flags [P.], seq 45808:45972, ack 37, win 501, length 164
00:19:00.934374 IP ubuntu-s-1vcpu-1gb-nyc1-01.ssh > 69.166.116.10.5276: Flags [P.], seq 45972:46136, ack 37, win 501, length 164
00:19:00.934425 IP ubuntu-s-1vcpu-1gb-nyc1-01.ssh > 69.166.116.10.5276: Flags [P.], seq 46136:46300, ack 37, win 501, length 164
00:19:00.934474 IP ubuntu-s-1vcpu-1gb-nyc1-01.ssh > 69.166.116.10.5276: Flags [P.], seq 46300:46464, ack 37, win 501, length 164
00:19:00.934524 IP ubuntu-s-1vcpu-1gb-nyc1-01.ssh > 69.166.116.10.5276: Flags [P.], seq 46464:46628, ack 37, win 501, length 164
00:19:00.934572 IP ubuntu-s-1vcpu-1gb-nyc1-01.ssh > 69.166.116.10.5276: Flags [P.], seq 46628:46792, ack 37, win 501, length 164
00:19:00.934623 IP ubuntu-s-1vcpu-1gb-nyc1-01.ssh > 69.166.116.10.5276: Flags [P.], seq 46792:46956, ack 37, win 501, length 164
00:19:00.934703 IP ubuntu-s-1vcpu-1gb-nyc1-01.ssh > 69.166.116.10.5276: Flags [P.], seq 46956:47120, ack 37, win 501, length 164
00:19:00.934755 IP ubuntu-s-1vcpu-1gb-nyc1-01.ssh > 69.166.116.10.5276: Flags [P.], seq 47120:47284, ack 37, win 501, length 164
00:19:00.934806 IP ubuntu-s-1vcpu-1gb-nyc1-01.ssh > 69.166.116.10.5276: Flags [P.], seq 47284:47448, ack 37, win 501, length 164
00:19:00.934858 IP ubuntu-s-1vcpu-1gb-nyc1-01.ssh > 69.166.116.10.5276: Flags [P.], seq 47448:47612, ack 37, win 501, length 164
00:19:00.934908 IP ubuntu-s-1vcpu-1gb-nyc1-01.ssh > 69.166.116.10.5276: Flags [P.], seq 47612:47776, ack 37, win 501, length 164
00:19:00.934961 IP ubuntu-s-1vcpu-1gb-nyc1-01.ssh > 69.166.116.10.5276: Flags [P.], seq 47776:47940, ack 37, win 501, length 164
00:19:00.935014 IP ubuntu-s-1vcpu-1gb-nyc1-01.ssh > 69.166.116.10.5276: Flags [P.], seq 47940:48104, ack 37, win 501, length 164
00:19:00.935070 IP ubuntu-s-1vcpu-1gb-nyc1-01.ssh > 69.166.116.10.5276: Flags [P.], seq 48104:48268, ack 37, win 501, length 164
00:19:00.935124 IP ubuntu-s-1vcpu-1gb-nyc1-01.ssh > 69.166.116.10.5276: Flags [P.], seq 48268:48432, ack 37, win 501, length 164
00:19:00.935177 IP ubuntu-s-1vcpu-1gb-nyc1-01.ssh > 69.166.116.10.5276: Flags [P.], seq 48432:48596, ack 37, win 501, length 164
00:19:00.935229 IP ubuntu-s-1vcpu-1gb-nyc1-01.ssh > 69.166.116.10.5276: Flags [P.], seq 48596:48760, ack 37, win 501, length 164
00:19:00.935281 IP ubuntu-s-1vcpu-1gb-nyc1-01.ssh > 69.166.116.10.5276: Flags [P.], seq 48760:48924, ack 37, win 501, length 164
00:19:00.935332 IP ubuntu-s-1vcpu-1gb-nyc1-01.ssh > 69.166.116.10.5276: Flags [P.], seq 48924:49088, ack 37, win 501, length 164
00:19:00.935384 IP ubuntu-s-1vcpu-1gb-nyc1-01.ssh > 69.166.116.10.5276: Flags [P.], seq 49088:49252, ack 37, win 501, length 164
00:19:00.935434 IP ubuntu-s-1vcpu-1gb-nyc1-01.ssh > 69.166.116.10.5276: Flags [P.], seq 49252:49416, ack 37, win 501, length 164
00:19:00.935486 IP ubuntu-s-1vcpu-1gb-nyc1-01.ssh > 69.166.116.10.5276: Flags [P.], seq 49416:49580, ack 37, win 501, length 164
00:19:00.935535 IP ubuntu-s-1vcpu-1gb-nyc1-01.ssh > 69.166.116.10.5276: Flags [P.], seq 49580:49744, ack 37, win 501, length 164
00:19:00.935585 IP ubuntu-s-1vcpu-1gb-nyc1-01.ssh > 69.166.116.10.5276: Flags [P.], seq 49744:49908, ack 37, win 501, length 164
00:19:00.935637 IP ubuntu-s-1vcpu-1gb-nyc1-01.ssh > 69.166.116.10.5276: Flags [P.], seq 49908:50072, ack 37, win 501, length 164
00:19:00.947286 IP 69.166.116.10.5276 > ubuntu-s-1vcpu-1gb-nyc1-01.ssh: Flags [.], ack 45316, win 508, length 0
00:19:00.947326 IP ubuntu-s-1vcpu-1gb-nyc1-01.ssh > 69.166.116.10.5276: Flags [P.], seq 50072:50236, ack 37, win 501, length 164
00:19:00.947476 IP ubuntu-s-1vcpu-1gb-nyc1-01.ssh > 69.166.116.10.5276: Flags [P.], seq 50236:50520, ack 37, win 501, length 284
00:19:00.947520 IP ubuntu-s-1vcpu-1gb-nyc1-01.ssh > 69.166.116.10.5276: Flags [P.], seq 50520:50684, ack 37, win 501, length 164
00:19:00.947565 IP 69.166.116.10.5276 > ubuntu-s-1vcpu-1gb-nyc1-01.ssh: Flags [.], ack 46464, win 513, length 0
00:19:00.947569 IP ubuntu-s-1vcpu-1gb-nyc1-01.ssh > 69.166.116.10.5276: Flags [P.], seq 50684:50848, ack 37, win 501, length 164
00:19:00.947616 IP ubuntu-s-1vcpu-1gb-nyc1-01.ssh > 69.166.116.10.5276: Flags [P.], seq 50848:51132, ack 37, win 501, length 284
00:19:00.947655 IP ubuntu-s-1vcpu-1gb-nyc1-01.ssh > 69.166.116.10.5276: Flags [P.], seq 51132:51296, ack 37, win 501, length 164
00:19:00.947692 IP ubuntu-s-1vcpu-1gb-nyc1-01.ssh > 69.166.116.10.5276: Flags [P.], seq 51296:51460, ack 37, win 501, length 164
00:19:00.947729 IP ubuntu-s-1vcpu-1gb-nyc1-01.ssh > 69.166.116.10.5276: Flags [P.], seq 51460:51624, ack 37, win 501, length 164
00:19:00.947765 IP ubuntu-s-1vcpu-1gb-nyc1-01.ssh > 69.166.116.10.5276: Flags [P.], seq 51624:51788, ack 37, win 501, length 164
00:19:00.947804 IP ubuntu-s-1vcpu-1gb-nyc1-01.ssh > 69.166.116.10.5276: Flags [P.], seq 51788:51952, ack 37, win 501, length 164
00:19:00.947841 IP ubuntu-s-1vcpu-1gb-nyc1-01.ssh > 69.166.116.10.5276: Flags [P.], seq 51952:52116, ack 37, win 501, length 164
00:19:00.947878 IP ubuntu-s-1vcpu-1gb-nyc1-01.ssh > 69.166.116.10.5276: Flags [P.], seq 52116:52280, ack 37, win 501, length 164
00:19:00.947928 IP ubuntu-s-1vcpu-1gb-nyc1-01.ssh > 69.166.116.10.5276: Flags [P.], seq 52280:52444, ack 37, win 501, length 164
00:19:00.950030 IP 69.166.116.10.5276 > ubuntu-s-1vcpu-1gb-nyc1-01.ssh: Flags [.], ack 48760, win 513, length 0
00:19:00.950048 IP ubuntu-s-1vcpu-1gb-nyc1-01.ssh > 69.166.116.10.5276: Flags [P.], seq 52444:52608, ack 37, win 501, length 164
00:19:00.950124 IP ubuntu-s-1vcpu-1gb-nyc1-01.ssh > 69.166.116.10.5276: Flags [P.], seq 52608:52892, ack 37, win 501, length 284
00:19:00.950165 IP ubuntu-s-1vcpu-1gb-nyc1-01.ssh > 69.166.116.10.5276: Flags [P.], seq 52892:53056, ack 37, win 501, length 164
00:19:00.950202 IP ubuntu-s-1vcpu-1gb-nyc1-01.ssh > 69.166.116.10.5276: Flags [P.], seq 53056:53220, ack 37, win 501, length 164
00:19:00.950240 IP ubuntu-s-1vcpu-1gb-nyc1-01.ssh > 69.166.116.10.5276: Flags [P.], seq 53220:53384, ack 37, win 501, length 164
00:19:00.950278 IP ubuntu-s-1vcpu-1gb-nyc1-01.ssh > 69.166.116.10.5276: Flags [P.], seq 53384:53548, ack 37, win 501, length 164
00:19:00.950315 IP ubuntu-s-1vcpu-1gb-nyc1-01.ssh > 69.166.116.10.5276: Flags [P.], seq 53548:53712, ack 37, win 501, length 164
00:19:00.950353 IP ubuntu-s-1vcpu-1gb-nyc1-01.ssh > 69.166.116.10.5276: Flags [P.], seq 53712:53876, ack 37, win 501, length 164
00:19:00.950390 IP ubuntu-s-1vcpu-1gb-nyc1-01.ssh > 69.166.116.10.5276: Flags [P.], seq 53876:54040, ack 37, win 501, length 164
00:19:00.950441 IP ubuntu-s-1vcpu-1gb-nyc1-01.ssh > 69.166.116.10.5276: Flags [P.], seq 54040:54204, ack 37, win 501, length 164
00:19:00.950479 IP ubuntu-s-1vcpu-1gb-nyc1-01.ssh > 69.166.116.10.5276: Flags [P.], seq 54204:54368, ack 37, win 501, length 164
00:19:00.950516 IP ubuntu-s-1vcpu-1gb-nyc1-01.ssh > 69.166.116.10.5276: Flags [P.], seq 54368:54532, ack 37, win 501, length 164
00:19:00.950552 IP ubuntu-s-1vcpu-1gb-nyc1-01.ssh > 69.166.116.10.5276: Flags [P.], seq 54532:54696, ack 37, win 501, length 164
00:19:00.950589 IP ubuntu-s-1vcpu-1gb-nyc1-01.ssh > 69.166.116.10.5276: Flags [P.], seq 54696:54860, ack 37, win 501, length 164
00:19:00.950787 IP 69.166.116.10.5276 > ubuntu-s-1vcpu-1gb-nyc1-01.ssh: Flags [.], ack 50072, win 508, length 0
00:19:00.950796 IP ubuntu-s-1vcpu-1gb-nyc1-01.ssh > 69.166.116.10.5276: Flags [P.], seq 54860:55024, ack 37, win 501, length 164
00:19:00.950845 IP ubuntu-s-1vcpu-1gb-nyc1-01.ssh > 69.166.116.10.5276: Flags [P.], seq 55024:55308, ack 37, win 501, length 284
00:19:00.950882 IP ubuntu-s-1vcpu-1gb-nyc1-01.ssh > 69.166.116.10.5276: Flags [P.], seq 55308:55472, ack 37, win 501, length 164
00:19:00.950918 IP ubuntu-s-1vcpu-1gb-nyc1-01.ssh > 69.166.116.10.5276: Flags [P.], seq 55472:55636, ack 37, win 501, length 164
00:19:00.950957 IP ubuntu-s-1vcpu-1gb-nyc1-01.ssh > 69.166.116.10.5276: Flags [P.], seq 55636:55800, ack 37, win 501, length 164
00:19:00.950994 IP ubuntu-s-1vcpu-1gb-nyc1-01.ssh > 69.166.116.10.5276: Flags [P.], seq 55800:55964, ack 37, win 501, length 164
00:19:00.951030 IP ubuntu-s-1vcpu-1gb-nyc1-01.ssh > 69.166.116.10.5276: Flags [P.], seq 55964:56128, ack 37, win 501, length 164
00:19:00.951069 IP ubuntu-s-1vcpu-1gb-nyc1-01.ssh > 69.166.116.10.5276: Flags [P.], seq 56128:56292, ack 37, win 501, length 164
00:19:00.959795 IP 69.166.116.10.5276 > ubuntu-s-1vcpu-1gb-nyc1-01.ssh: Flags [.], ack 50236, win 513, length 0
00:19:00.959796 IP 69.166.116.10.5276 > ubuntu-s-1vcpu-1gb-nyc1-01.ssh: Flags [.], ack 50684, win 511, length 0
00:19:00.959828 IP ubuntu-s-1vcpu-1gb-nyc1-01.ssh > 69.166.116.10.5276: Flags [P.], seq 56292:56456, ack 37, win 501, length 164
00:19:00.959989 IP ubuntu-s-1vcpu-1gb-nyc1-01.ssh > 69.166.116.10.5276: Flags [P.], seq 56456:56852, ack 37, win 501, length 396
00:19:00.960039 IP ubuntu-s-1vcpu-1gb-nyc1-01.ssh > 69.166.116.10.5276: Flags [P.], seq 56852:57016, ack 37, win 501, length 164
00:19:00.961062 IP 69.166.116.10.5276 > ubuntu-s-1vcpu-1gb-nyc1-01.ssh: Flags [.], ack 52116, win 513, length 0
